ㄹ,0
111,"이유는 없구요 맨날 누워있어가지고 그럼좀 삶이 반복되는게 지루해요-맨날 누워 있으니까 지루하지요새로운 사람 새로운 장소에 가고 싶은데 무서워요-무서운게 아니라 가기 귀찮은 겁니다.사람이 싫은데 사람을 좋아하고 -말도 안되는 소리새로운 장소에 가는 것도 좋아하는데 두려워요-그것도 귀찮은 겁니다.-산에 가서 심마니로 살까요?-심마니 해볼래요? 심봤다!!!!!!삶이 재밌어지는 방법 추천해주세요 내공 100-당신 삶이 재미있군요 심마니라..심봤다!!!!!!!!!!!안녕하세요 :) 마인드원 심리상담센터입니다. 질문자님은 삶이 반복되는게 지루함을 느끼시나요?실제로 우울증을 겪고 계시는 분들은우울감보다는 모든일에 흥미가 저하되어 공허함을 더 많이 느낀다고 합니다.우선 우울증의 증상에 대해서 설명을 해드릴게요.1.하루의 대부분, 거의 매일 우울한 기분이 지속2.거의 모든 일상활동에 대한 흥미나 즐거움이 뚜렷하게 저하3.현저한 체중감소나 증가 또는 식욕감소나 증가가 거의 매일4.불면이나 과다수면5.안절부절못함6.피로감이나 활력상실7.무가치함이나 과도하고 부절적함 죄책감8.사고력이나 집중력의 감소 또는 우유부단함1,2번 필수 그 외 3가지 이상의 증상이 거의 매일 2주이상 나타날 때 우울증이라고 진단하게 됩니다.가벼운 우울증인 경우는 운동이 효과가 있다고 알려져있습니다. 이밖에 요가나 명상 도 도움이 되고 허브차도 도움이 됩니다. 라벤더는 심신을 안정시키는 작용을 하고 우울한 경우에는 쟈스민도 좋다고 알려져있습니다.그 외 질문자님이 좋아하는 일을 하는것이 스트레스 해소하는 방법이 아닐까생각합니다.음악듣기 산책하기 친구들과 수다 떨기, 맛있는 음식 먹기등등 여러 가지가 있을것입니다.하지만 가벼운 경우가 아니고 심각한 수준이라면 전문가의 도움을 받으셔야합니다.자신만의 해소법을 찾아내어 해 보시고 그래도 일상생활에 지장이 생길 정도이면 전문기관을 찾으시는 게 가장 빠른 방법입니다.우울증의 원인이나 상담을 원할경우는 심리치료를 할수있는상담센터를 방문하시는것이 바람직할것 같습니다.도움이 되었으면 하는 마음에,비슷한 어려움을 가지고 계신 분들의 상담후기 첨부해드립니다.우울증 http://www.mindone2.kr/board/board_list.php?board_name=review1&search_category=&search_field=subject+contents&search_text=%EC%9A%B0%EC%9A%B8%EC%A6%9D&search_operator=and&x=0&y=0"
112,"일단 정신병원 날짜 잡아서 가보세요.처음가면 테스트 하고 상담받고 약처방합니다.최대한 빨리 가시고, 왠만하면 가족중에 제일 편한사람에게 말해서 동행하세요.동행할 상황이 여의치않으면 혼자가도 상관없어요버티지 말고밖에 나가서 걷기 뛰기 한 시간 하세요.스스로에게 좋은 친구가 되세요.안녕하세요, 차주현심리상담센터입니다:)질문자님께서 어떤 부분에 스트레스를 받고 우울감을 느끼시는지 자세히 모르겠지만위의 이야기를 읽어보았을 때 불안감과 우울감을 많이 느끼시는 것으로 보입니다. 주변 분들에게 이에 대한 고민을 털어놓기 힘들어 많이 힘드시죠..고통스러운 감정에서 벗어나기 위해 '자해'를 선택하는 경우가 있습니다. 계속해서 자해 행위가 생각이 나고 참고 계신다면 하루 빨리 가까운 심리상담센터에 가시길 권유드립니다. 자해가 지속되어 자살로 이어지는 경우가 드물지 않습니다.혼자서 고민하기 보다 부모님께 알리는 편이 질문자님을 위해서라도 좋을 것 같습니다.지금의 밝은 모습뿐만 아니라 힘든 부분가지도 다 이해해주실거예요. 너무 걱정하지 마시고 부모님께 이야기를 해보는 것도 좋을 것 같아요.현재 상황이 되지 않아 센터에 가시지 못하신다면, 아래의 방법으로 조금이나마 도움이 되길 바랍니다.1. 스트레스 완화 질문자님께서 스트레스를 자주 받는 상황이라면 즉각적으로 스트레스를 해소할 수 있는자신만의 '해소법'을 찾는 것이 가장 좋습니다. 예를 들어 컬러링 북, 아크릴 페인팅, 스크래치 포스터, 명화 퍼즐 등이 있습니다. 위의 방법들은 단순 작업으로 마음의 안정을 찾는데 많은 도움이 될 것입니다. 2. 아무생각 없이 하루 살아보기혹시 과거나 미래에 대한 고민들로 하루를 보내시지는 않으신가요...?하루정도는 아무생각 없이 드라마, 영화 등을 보며 시간을 보내는 것도 좋은 방법 중 하나입니다. 아무생각 없이 하루를 보내면 어느 순간 고민이 생각나지 않을 때도 있을거예요:)3. 이완 요법정신적 긴장이 근육의 긴장을 유도해 스트레스와 우울감을 느끼게 합니다. 따라서 근육 긴장을 완화시켜 정신적 긴장까지 해소하는 방법이 있습니다. 예를 들어 명상, 요가, 필라테스 등으로 긴장감을 해소하는데 많은 도움이 될거예요.4. 버킷리스트 작성삶의 목표이자 평소 하고 싶었던 일들을 리스트로 작성해보시는 것은 어떨까요?버킷리스트를 작성하시면 삶의 의미를 느끼며 우울감도 많이 해소될 거예요.저희 센터에도 질문자님과 같은 이유로 방문해주시고, 상담을 받는 경우가 있습니다. 이러한 고민을 하는 것이 전혀 이상하지 않다는 것을 말씀해드리고 싶어요.꼭 저희 센터가 아니라도 좋으니 빠른 시일 내에 가까운 전문기관에 방문하시길 바랍니다. 평온한 하루 보내시고, 도움되셨다면 채택부탁드립니다:) 두려운 마음은 이해가 되고도 남습니다.궁극적으로는 가족, 남자친구는 알아야 이해하고 도와줄 수 있는데구체적인 것은 *님 글에서 답해 보지요.+++자해하고싶은걸 주변에 알려야 할까요20대 여자인데요요즘 너무 스트레스 받아서 (스트레스의 원인은 모르겠습니다 그냥 조금의 자극만 받아도 기름에 물방울 떨어지는것처럼 발작을 일으켜요) 스트레스에는 자신이 알 수 없는 무의식적인 것들이 훨씬 더 많아서심리치료 전문가의 도움을 받아야 합니다.어머니는 우울증을 앓고 계시다 했는데 이런 어머니에게서 자라는 아이는 스트레스가 엄청 많을 수밖에 없습니다. 어떻게라도 스트레스를 해소해보려고 술담배 다 해봣습니다만 별 효과가 없었습니다..스트레스의 정확한 원인을 먼저 알아내고그 원인 별로 적절히 해소해 내야 하는 것이지,술담배 등은 당시의 느낌만 풀리는 것 같을 뿐, 실제로는 더 쌓입니다.그런데 입술 뜯고 피나거나 실수로 씹어서 피나거나 넘어져서 피나는게 좀 해소되는 느낌이 있더라구요..아린거도 처음에나 아프고 나중엔 찌릿해서 좋은거같고....이런 것들도 자해의 성격과 같습니다.고통이 있으면 그를 보상하는 엔돌핀이 분비되면서 좋은거처럼 느끼게 되는 것이에요.그래서 자해가 너무 하고싶은데 이 때 조절하지 못하면 중독처럼 되지요.주변사람들이 그 흔적을 보면 절 얼마나 걱정하고 자책할까 싶어서 참고있어요..힘든건 저 하나면 충분한데 주변에 걱정과 자책 등의 부정적인 감정을 넘기기 싫어서 이 이유 하나만으로 참고있는데 이런 제 상황을 주변에 말하는게 좋을까요?마음 자세는 훌륭하지만 치료를 위해서는 정말 중요한 대상들은 아는 것이 필요해요.다만, 방법은 좀 생각해 볼 필요가 있어요.제 남자친구은 이미 어느정도 제가 굉장히 우울하고 무기력한 상태인걸 잘 알고 있고, 전에 엄청 징징거렸습니다.. 부모님은 아무것도 모르시구요..!사실, 부모님은 아무것도 모르시는 것 자체가 문제가 있는 것입니다.그만큼 자식에 대해 민감하시지 못한 것이지요.부모는 자식에 대해 정말 민감해야 합니다, 물론 도움을 주는 쪽으로요.근데 남자친구에게 말하기엔 또 징징거리는거로 보일거같고 저에게 정이 떨어질 것 같아서 말을 못하겠습니다남자친구는 사실을 알 필요가 있고, 가능한 만큼 이해하고 도와야 합니다.그러나 계속 징징거리는? 형태는 안 되고, 치료를 받아야 하는 일이에요.부모님은 제가 쾌활하고 밝은줄 아셔서 이건 아이가 힘든 데도 엄청나게 노력했다는 증거입니다.이런 일은 엄청난 스트레스가 되구요.이런 이야기를 들으면 엄청 충격먹고 자책하실거 같아서 말을 못하겠어요.. 특히 어머니는 우울증을 앓고 계셔서요그럼에도 불구하고 이걸 말 해야할까요 제 모든걸 잃을까봐 무서워요조심스럽게 접근해 봐야죠...부모님께는 자해라고 밝히지 말고, 조금 마음이 힘들어져서 혹시라도 병으로 키우지 않도록진료와 상담을 한 번 받아보고 싶다는 정도로 시작할 수 있으면 좋을 것 같아요.후에 전문가와 상의하면서 부모님께 알릴 방법을 생각해 보세요.어머니도 마찬가지지만, 알아야 할 정말 중요한 내용이 있어요.이런 정신질환의 가장 중요하고 기본적인 치료가 심리치료라는 사실입니다.우울증이든 자해든,정신과의 약물치료만으로는 나을 수 없어요.치료 방법에 대해서는 아래의 붙임글을 참고하세요.+++심리치료는 일반 심리상담과는 완전히 다른 것인데심리치료(전문적 단계의 심리상담)에 대해서는 다음 글을 읽어보세요.http://blog.naver.com/mindstay701/221972341351심리치료에 대해 잘모르겠어요 - 병원은 뭐가 있고, 센터는 뭐가 있는지/치료비용?심리치료에 대해 잘모르곘습니다.심리치료를 받으려고 하는데 대학교 병원? 은 뭐가 있고, 센터는 뭐가 있...blog.naver.com나머지 치료법은 아래의 붙임글을 참고하세요.(좀 더 상세한 설명은 마음놀이터의 블로그에 있습니다.)우울증, 자해, 스트레스 증상 항목 등, 도움이 되는 내용들이 제 블로그에 정리되어 있으니 참고해 보세요.블로그 내에서 관련이 있다고 짐작되는 항목이나 검색어로 찾아보세요.어린 시절 관련해서도 블로그에서 내부 검색으로 찾아보세요.(※ 주 : PC로 보는 것이 훨씬 더 쉽게 잘 찾을 수 있습니다.)심리상담연구공간 마음놀이터https://blog.naver.com/mindstay701심리상담연구공간 마음놀이터 : 네이버 블로그심리치료/심리상담 센터, 서울 이태원 Naver 지식iN 마음놀이터 정신건강의학과 https://www.facebook.com/2mam2blog.naver.com*** 이해를 돕기 위해 마음놀이터 블로그의 치료법 항목을 요약한 내용입니다. ***** 정신질환의 원인 : 과도한 정신적 스트레스 ** 정신적 스트레스(의 원인)= 현재의 모든 힘든 상황들 + 과거의 힘들었던 기억들(무의식적 스트레스 포함)+ 현재 쓰이는 모든 에너지(긍정적인 부분 포함)** 정신질환의 치료법 : * 심리상담소의 심리치료 (X 일반 심리상담) = 원인 치료 (필수) :과도한 정신적 스트레스를 없애거나 줄여야 함---> (일반 심리상담이 아닌, 뇌, 신경계, 호르몬의 작동을 이해하고 무의식까지 다룰 수 있는 수준의 심리치료). 어떤 경우든 필요함.약물치료와 병행하는 경우에는 약을 끊고도 이상증상이 없고 일상을 편안히 할 수 있을 때 종결.(정신과에서 하는 간단한 상담 정도로는 심리치료가 되기 어렵습니다.훨씬 더 정교하고 심층적인 심리상담이 되어야 해요.최근에는 심리치료를 하는 정신과가 생기고 있는데, 1회에 최소 45분 이상의 상담을 하는지를 기준으로 심리치료인지를 1차적으로 확인할 수 있습니다.)* 정신과 약물치료 ---> 원인과는 상관없이 호르몬 등의 균형이 깨어져 자극을 받는 신경계를 안정시킴으로써 드러나는 증상만 완화시킴. 원인은 그대로 남아서 영향을 계속 미치게 됨. 자각하는 증상이 심하여 일상에 지장을 받을 때 보조적으로 필요함.심리치료로 조금씩 나아지면 약을 줄여가다가 중단할 수 있게 됨."
113,"아 글쓴이분 어떻게 이렇게 제가 글로 밖에 위로라면 위로일까 방법이라면 방법일까 도움이라면 도움이 될지는 모르나 이렇게 그냥 대답해서 죄송하고, 성의 없게 들릴수도 있지만한사람의 진심으로 지나가는 말일지라도 들어주셨으면 좋겠어요.아그리고 이 답변은 아까 보실지 모르겠지만 이답변을 아까 힘들다고 구타도 당하시고 그냥 살라는 말도 힘드시다는 분도 같이 보셨으면 너무 좋겠습니다 질문을 삭제하셔서 너무 걱정이 되네요. 답변입니다 ^^---->감정기복이 심하다.. 예민하다.. 이런건 타고날수도 있고 환경이 그렇게 만들수도 있어요.. 그리고 세상이 불공평하다는말 저도어릴땐 몰랐는데 인정해야 되더라구요,근데 웃긴게 그래도 옛사람들이 하는말이 웃긴게 쥐구멍에도 볕뜰날 있고, 비온뒤에 땅이 굳는 다고 하는 말이 있잖아요 더단단해진다잖아요그게 그만큼 큰 사람이 되기 위해서 이지 않을까하고 저는 바래봅니다.누구도 그 환경에 대하여 겪어보지 않고는 말하는건 예의가 아니고, 저또한 예의넘지만그냥 지나가는 말이라 생각하시고 들어주시고 힘되는것만 챙겨가시면 좋겠습니다.혼자서도 잘해내실 것 같거든요 앞으로지금까지 잘 버티고 잘하신 거고, 스스로가 옳다는 걸 계속해서 알아주셨으면 좋겠습니다.잘못하면 어떻하지 내가 잘할수 있을까?많은 생각이 드시죠? 별의 별 생각이 다 드시고 우울할수도 있어요.무언가 시작할 때 새로움에 대한 두려움, 또 불확실한 상황들을 마주하는 것에 대한 용기가 부족할 수도 있어요.스스로에 대한 자신감이 떨어지게 된 상태라면 더더욱 마음이 조급하고 초조할 수 있어요. 하지만 글쓴이님에게 이 말씀을 드리고 싶어요. 완벽하지 않아도 된다고 말이에요. 우리가 보통 두려움을 느끼는 경우는 완벽하고 싶은 욕구와 압박감이 나를 괴롭게 하기 때문이에요. 그러기 때문에 스스로를 깎아 내리고 비난하는 말보다는 세워주는 말들로 글쓴이님의 내면을 조금 더 단단하게 만들어주셨으면 좋겠어요. 힘내세요 당신이 일어서서 누군가의 손을 잡아줄 수 있는 사람이 되기를 바랍니다.  우울증으로 많이 힘든 것 같네요.부모님과 사이가 나쁘지 않고 학교 생활도 문제가 없는것 같은데 왜 우울한지 모르겠다는 말씀이신 것 같아요.우울증은 어떠한 계기가 있어서 오기도 하지만 이유없이 오기도 합니다. 기질적인 영향도 있고 성격적인 부분도 있을 수 있어요. 원인은 다양하기 때문에 이렇게 짧은 글로 작성자님의 우울증의 원인에 대한 답을 드리긴 어려울 것 같다는 생각이 듭니다. 하지만 지금 작성해주신 걸로 봤을 때 대략적인 생각으로는 작성자님은 걱정이 많으신것 같습니다. 걱정과 불안은 우울과 친해요. 부모님께서 나이가 많으시고 내가 17세가 되면 부모님은 은퇴하실거고 돈을 벌어야 하는데 무얼해서 돈을 버나, 어떻게 살아가나, 나의 삶은 왜이러나... 이러한 느낌이 있는 것 같다는 생각이 드네요.그러한 생각이 자꾸드니 걱정이 되고 미래가 불안하고 우울감이 더 드는게 아닐까 라는 생각이 듭니다. 우울증 약은 텐션을 좀 올려주는 역할을 하죠. 나의 사고방식을 바꾸거나 인생의 목표를 세워주지는 않습니다. 정신과 약을 복용할 경우 모두 그런것은 아니나 대부분은 상담을 병행하는 것이 좋습니다. 무기력하고 수면의 질이 좋지 않고 식욕부진 등 신체적 증상이 나타나는 부분에 있어서는 약물치료가 도움이 될 수 있으니 꾸준히 복용하며 심리치료를 통해 나의 우울의 원인이 무엇인지 그리고 앞으로 나는 어떻게 극복해 나갈 수 있는지 찾아나가는 것이 도움 될 것 같다는 생각이 듭니다.작성자님은 노래를 통해 자신의 스트레스, 우울감을 조금 극복하고 위로받는 다는 생각이 들어요.자신만의 스트레스 해소법을 찾는 것은 중요합니다. 다양한 방법을 시도해보고 나 자신과 타인에게 피해가 되지 않는 선에서 긍정적인 스트레스 해소법을 몇가지 찾아보세요. 도움이 될거란 생각이 듭니다."
114,"음 저두 그래요같이 힘내봅시다같은 상황에 잇는 사람끼리 힘내면 더 좋은 일 있을거예요안녕하세요 :)마인드원 심리상담센터입니다.질문자님은 인간관계로 인해 우울감을 느끼시나요?우선 우울증의 증상에 대해서 설명을 해드릴게요.1.하루의 대부분, 거의 매일 우울한 기분이 지속2.거의 모든 일상활동에 대한 흥미나 즐거움이 뚜렷하게 저하3.현저한 체중감소나 증가 또는 식욕감소나 증가가 거의 매일4.불면이나 과다수면5.안절부절못함6.피로감이나 활력상실7.무가치함이나 과도하고 부절적함 죄책감8.사고력이나 집중력의 감소 또는 우유부단함1,2번 필수 그 외 3가지 이상의 증상이 거의 매일 2주이상 나타날 때 우울증이라고 진단하게 됩니다.가벼운 우울증인 경우는 운동이 효과가 있다고 알려져있습니다. 이밖에 요가나 명상 도 도움이 되고 허브차도 도움이 됩니다. 라벤더는 심신을 안정시키는 작용을 하고 우울한 경우에는 쟈스민도 좋다고 알려져있습니다.그 외 질문자님이 좋아하는 일을 하는것이 스트레스 해소하는 방법이 아닐까생각합니다.음악듣기 산책하기 친구들과 수다 떨기, 맛있는 음식 먹기등등 여러 가지가 있을 것입니다.하지만 가벼운 경우가 아니고 심각한 수준이라면 전문가의 도움을 받으셔야합니다.자신만의 해소법을 찾아내어 해 보시고 그래도 일상생활에 지장이 생길 정도이면 전문기관을 찾으시는 게 가장 빠른 방법입니다. 우울증의 원인이나 상담을 원할경우는 심리치료를 할수있는상담센터를 방문하시는것이 바람직할것 같습니다.도움이 되었으면 하는 마음에,비슷한 어려움을 가지고 계신 분들의 상담후기 첨부해드립니다.우울증 http://www.mindone2.kr/board/board_list.php?board_name=review1&search_category=&search_field=subject+contents&search_text=%EC%9A%B0%EC%9A%B8%EC%A6%9D&search_operator=and&x=0&y=0이 음악이 질문자님께 위로가 되셨으면 좋겠습니다"
115,"아무래도 사람자체가 무기력해지니까 각자 다르더라도 그렇지 않을까요?안녕하세요 :)마인드원 심리상담센터입니다.방안에만 있으면 햇빛을 보지 못해 신체적으로 우울감을 느낄 수 있지만그 외에 방안에만 있고 싶은 기분을 느끼는 거라면왜 그런 생각을 하는지 살펴보는 것이 더 중요할 것 같습니다.우선 우울증의 증상에 대해서 설명을 해드릴게요.1.하루의 대부분, 거의 매일 우울한 기분이 지속2.거의 모든 일상활동에 대한 흥미나 즐거움이 뚜렷하게 저하3.현저한 체중감소나 증가 또는 식욕감소나 증가가 거의 매일4.불면이나 과다수면5.안절부절못함6.피로감이나 활력상실7.무가치함이나 과도하고 부절적함 죄책감8.사고력이나 집중력의 감소 또는 우유부단함1,2번 필수 그 외 3가지 이상의 증상이 거의 매일 2주이상 나타날 때 우울증이라고 진단하게 됩니다.가벼운 우울증인 경우는 운동이 효과가 있다고 알려져있습니다. 이밖에 요가나 명상 도 도움이 되고 허브차도 도움이 됩니다. 라벤더는 심신을 안정시키는 작용을 하고 우울한 경우에는 쟈스민도 좋다고 알려져있습니다.그 외 질문자님이 좋아하는 일을 하는것이 스트레스 해소하는 방법이 아닐까생각합니다.음악듣기 산책하기 친구들과 수다 떨기, 맛있는 음식 먹기등등 여러 가지가 있을 것입니다.하지만 가벼운 경우가 아니고 심각한 수준이라면 전문가의 도움을 받으셔야합니다.자신만의 해소법을 찾아내어 해 보시고 그래도 일상생활에 지장이 생길 정도이면 전문기관을 찾으시는 게 가장 빠른 방법입니다. 우울증의 원인이나 상담을 원할경우는 심리치료를 할수있는상담센터를 방문하시는것이 바람직할것 같습니다.도움이 되었으면 하는 마음에,비슷한 어려움을 가지고 계신 분들의 상담후기 첨부해드립니다.우울증 http://www.mindone2.kr/board/board_list.php?board_name=review1&search_category=&search_field=subject+contents&search_text=%EC%9A%B0%EC%9A%B8%EC%A6%9D&search_operator=and&x=0&y=0"
116,"이런 곳에 올리기보다 질문자님의 상태가 매우 걱정되니 병원에 빨리 가보시는게 좋을 것 같아요... 지식인 보다는 정신병원이 더 전문적이고 믿음이 가잖아요... 글만 읽어보면 많이 심각하신것같은데 하루빨리 마음의 건강을 되 찾고 건강해지셨으면 좋겠어요.. 너무 우울해하지마요ㅜㅜ심각한증상이네요,진료받고치료하세요,그리고우울증은햇빛을받으면좀낳아진답니다,하루에2~30분정도 햇빛을쪼이면서걸어보세요,비타민D의생성으로 상태가호전될것입니다,~**강박증 같아요. 스트레스 되도록 피하고 평소 명상을 해보세요. 머릿속에 불필요한 생각 하나도 안떠오르게 해보세요. 그리고 정신과질환이 없을려면 환경이 엄청 좋아야해요. 남들이 학교 다니고 직장다니고 연애도하고 차도 사고 집도 있고 가족도 있고 아내도 있고 아이도 있고 한다면요. 본인도 그런것이 충족되어야 합니다. 그리고 사회생활도 별 탈없이 잘 적응할수 있어야합니다. 사회생활이 조금만 해보면 이러면 되고 저러면 안좋고 이런게 학습이 되는데 보통 정신질환자가 이런 학습능력이 없고 적응을 못하고 무조건 비관적이거나 적대적으로 상대를 상대할려고 하고 또 그것으로 본인스스로 스트레스를 너무 많이받아 망가집니다. 이게 내가 봤을때 가장 중요합니다.그러니까 자기관리가 잘 되어야 되요. 남 하는만큼만 되어도 성공한거죠. 평소 생각이 너무 극단적으로 안좋게 불필요하게 가는거 같으면 본인이 우선 그게 잘못되었다는걸 감지해야하고 또 그것에 대해 스스로 조절할수 있어야 합니다."
