ㄹ,0
37,"안녕하세요. 질문자님.불안한 생각이 들면 자꾸 생각을 반복하게 되는 경우가 있는거 같아요.저도 예전에 그랬답니다.걱정이 되어서 마음도 무겁고, 몸도 무거워지고, 결국 우울감도 오게 되더라고요.그러다가 저도 불안감을 벗어나는 방법을 찾게 되더라고요.책에서 보거나 주변지인은 비교적 같은 조언을 해준답니다.바로 일어나지 않을 일을 미리 고민하지마라, 혹은, 고민하고 불안해하는 것중 하나도 안일어날 수도 있다. 등입니다.사실 이말은 맞는 말입니다. 하지만 당사자인 내가 그 사실을 알면서도 불안감을 떨칠수가 없다는 것이지요.결국 마지막에 제가 도달한 결론은 이것입니다.나의 성격의 특징이라는 것을요. 이 성격적 특징을 인정할 필요가 있는것이지요.""나는 크던, 작던, 내가 불안감을 느끼는 일이 생기면, 계속 곱씹는 성격이구나""""그렇게, 스스로를 성처입히는 사람이구나""내가 나빠서 그런게 아닙니다. 성장과정이나 내 가족환경이 그랬을수도 있고, 커가면서 어떤일로 변했을수도 있습니다. 하지만 대부분 전자이지요.그러니, 스스로를 괴롭히지 마시고, 불안한 마음이 반복될때는 ""아, 내가 또 남도 안괴롭히는데 내가 나를 괴롭히는구나, 그만하자""라는 생각을 차라리 반복하시기 바랍니다. "
38,"이세상은 감옥 입니다. 감옥이 좋은리가 없습니다.당연히 괴롭히는것입니다.. 그래서 그렇게 누군가를 통해서 기분 나쁘게 살기 싫게 만듧니다.죄를 최소화하고 일을 많이 해서 각자 다음생까지 채우지 않는 이상... 그렇습니다.가족,아빠,엄마,형,동생,친구,동료 모든 관계문제가족도 친구도... 뭔가 인연이 있어서 만난것입니다.전생기억은 없지만 심층의식은 그런것을 아주 오랫동안 간직하고 있어 호불호가 나뉜다고 합니다.즉 가족 이지만 전생에 어떤 일이 있어서 가족이 되었는지 기억이 안나는 것 입니다.참고로 생김새가 다르다면 오랜세월 같이 지낸것이 아닌 아무것도 모르는 상태에서 쌀이나 돈을 빌리거나 지원 받았거나 전쟁등등이나 불미스러운일로 섞인것 일수 있습니다. 물론 다른 예외도 있겠지만 말입니다.처지가 않좋은것은 채워놓은 바라밀도 적고...죄도 많고 근기수준도 낮아서 입니다.채워놓은 바라밀이 많고 죄도 적고 근기수준이 높으면 만나는 사람들도 좋은 사람들이고 관계도 좋고 사는게 수월해집니다즉 자신의 부족한부분 노동이나 지식 등등부분에 의해서 그렇게되는듯 한데... 그런 바라밀도 채우고 해서 연을 저절로 끊어지게 하는게 좋을듯 합니다.혹은 전생에 무언가 억울한 일을 당했다고 하더라도..그런일이 일어나지 않게 미리미리 잘 해놓는것이 좋았을것이고...나보다 근기수준이 떨어지는 존재가 원상복구나 민폐보상은 사실 힘들다고 봐야합니다.그냥 전생에 당해서 크게 뒤틀리고 엮이게되어서 아둥바둥된것이고 그래서 그렇습니다.아래 그림은 화엄사의 윤회 그림과 지옥도 입니다.이 그림이 거짓이면 불교 자체가 거짓 인것이나 다름 없으니 신빙성이 무척큽니다.즉 광음천의 천인들이 쌀등을 먹고 인간이 오랜세월에 걸려 되었으며 죄가 더 많아지자 축생이 되기도 하였다는 것입니다.죄를 줄이고 선행(바라밀)을 많이 채우고 근기수준이 높아지면 높아지고 죄가 많고 바라밀도 떨어지고 근기수준도 낮아지면 뱀 그 이하 지옥까지 갈 수 있는것 입니다.지옥에 죄인들과 지옥에서 중생들을 구제하기 위한 부처님 그림입니다.뭔가 그 사람의 처지나 입장이 크게 바뀌지 않는 이상 사람은 바뀌지 않습니다.단지 그처지에서는 그런 처세를 취하는데 그것은 바뀌는것이 아닌그냥 짜부라들거나 부풀어오르는 그 사람의 모습 그 자체 입니다...근거는 불교내용 입니다.사람들은 대단한 가르침을 받고 대단한 지원을 받아서 훌륭해 졌다고 해도...결국은 무척 긴 시간에 결처서 본다면 아주 잠깐 1천년 수준만 반짝 하고 원래대로 돌아간다고 합니다.질문자님께서 평소 좋아하고 관심있던 분야가 어떤 것인가요?저는 운동을 좋아하는 편이라 취미로 풋살이나 배드민턴 같은 활동을 하고 있어요나이가 어려도 취미생활로 운영하는 동호회 같은 곳도 찾아보면 있으니본인이 흥미를 느끼는 것을 찾아보시고 그 활동을 조금씩이라도 하면서 해소해보세요우울감은 근본적으로 복합적이죠.. 질문자님이 말씀하셨다시피 여러가지 요인들이 쌓여서 생기게 되는데 이 여러가지 요인들 중 주로 자존감이 낮아지게 하는 어떠한 생활습관, 활동, 또는 친구그와의 관계가 있습니다. 그렇다면 자존감을 높여야 우울감이 해소가 될 것이라는 결론에 다다르게 되는데.. 인간의 자존감은 기본적으로 자신이 무언갈 스스로 해냈다고 느끼는 성취감, 또는 남들의 인정에서 오게 됩니다. 질문자님이 평소 삶이 과연 뚜렸한 목표를 가지고 가고 있는지 아니면 그냥 평범하게 무미건조한 생활을 반복하고 있는건 아닌지 돌아볼 필요가 있다고 생각합니다. 즉 새로운 일을 해보라는 뜻이죠.. 그러나 취미생활이 맞지 않는다면 그냥 간단한 거라도 시도해 보세요 역으로 지식in 답변을 해본다던지, 아니면 유튜브에 있는 먹방 레시피를 집에서 간단히 해먹어본다든지 여러가지가 있을 겁니다. 그건 스스로 억지로라도 한번이라도 시도해 보자 라는 마인드를 가지는 게 가장 중요합니다 부족한 답변 지송ㅎㅎ"
39,"기간이 얼마 안됐다면 괜찮으실거에요~ 단순히 최근 육체적으로나 정신적으로 힘든일이 있어서 일시적 현상일 수도 있구요~ 그런데 오래되었다면 심리상담같은거 한번 받아보심이 어떨까 싶어요. 주위 우울증초기를 놓치고 계속 심해지는 친구도 봤었거든요 ㅠㅠ제 아이디 클릭하셔서 제 블로그에 쓴 글도 한번 읽어보시면 좋을것 같아요~햇빛 많이 쬐시고, 스트레스 푸는 방법을 찾아보세요~~우울감 및 무기력함 극복 방법을 알고 싶다고 하면서 우울증은 아닌 것 같다고 분석을 해내는 것은 자신을 참 잘 들여다 보고 잘 이해하고 있는 것 같습니다.내가 뭘 잘하는지 모르는 건 있을 수 있어도 뭘 좋아하는지 모르는 건 있을 수 없는데 자꾸만 내가 이걸 좋아하는게 맞나? 하고 생각하게 되는 것도 마찬가지입니다.우울증이 아니어도 우울감을 심하게 느낄 수 있습니다.결국은 뭐가 뭔지 모르겠다는 결론이지만, 이게 정확한 것입니다.전문적으로 무의식까지 분석해 보기 전에는, 일반인들로서는 모르겠다고 하는 답이 가장 잘 알고 있는 답인 것이에요.어떤 문제가 생겼는데, 내가 보니 이러저러한 것 같다고 섣불리 판단하는 것이 오히려 몰라서 그럴 수 있는 일입니다.*님이 겪고 있는 문제는 스트레스로 인한 증상들입니다.우리가 겪는 정신적인 문제들에는 현재의 진단 (분류) 체계에서 정확히 똑 떨어지게 분류되는 진단명이 없는 것들이 아주 많습니다.스트레스로 인한 증상들이라고 했지만, 이 스트레스에는 또 무한대의 내용들과 원인들이 있습니다.여기서 다룰 수 없는 무한대의 내용이므로, 심리적인 문제와 정신질환에 대한 이해와 치료법에 대한 다음 글을 읽어보면 좀 더 이해가 될 것입니다.kin.naver.com/open100/detail.nhn?d1id=7&dirId=70109&docId=1493917(링크가 열리지 않으면  kin.naver.com/profile/mindstay701 에서 오픈사전을 읽어보세요.) 어떤 사람의 정신적/심리적인 문제를 판단하거나 해결하려면, 그 사람의 현재까지의 전 생애를 살펴야 하는 일이에요.만약 *님이 25세라면, 25년간 어떻게 성장해 왔는지 이해해야 한다는 뜻입니다.그런데 대부분의 경우 이렇게 하지 않고(사실은 못하고) 현재 드러나는 증상만으로 판단/진단하고 섣부른 처방이나 조언을 합니다.혹은 코에 걸면 코걸이, 귀에 걸면 귀걸이 식의 답을 책임의식도 없이 주기도 해요.물론 대부분 선의이고, 몰라서 그러기는 합니다. 그러나 이 선의나 무지가 결과적으로는 해를 끼치게 되는 일도 흔합니다.상담을 진행해 보아야 정확한(혹은 진실에 가까운) 것을 알 수 있겠지만, *님의 상담글로는 자존감이 낮은 것이 원인이 되어 삶의 복잡하고 많은 일들과 얽히며 스트레스로 쌓여가고 있는 것 아닌가 싶습니다.노래를 듣거나 취미활동으로 푸는데 이제 그것도 소용이 없어진 것 같다고 했는데, 인터넷에서 쉽게 찾을 수 있는 수많은 해소법들은 아주 가벼운 단계에서는 도움이 되지만 어느 단계 이상 깊어지면 소용이 되지 않습니다.운동은 적절히 하면 건강한 사람에게도 도움이 되는 것이지만, 어떤 사람들은 열심히 운동을 하는 것을 줄이거나 쉬게 해야 할 필요도 있어요.스트레스가 많아지면 우리 뇌는 부정적인 생각이 많아지게 만듭니다.성격은 점점 신경질적이고 날카로워지는 것도 마찬가지구요.의지가 너무 약하다고 생각하는 사람들을 상담을 진행해 보면 무기력증이나 방어기제로 파악이 되는 사례들이 많습니다.심리상담소를 찾아서 심리상담을 받아보기 바랍니다.이런 일들은 그냥 두면 '평생' 문제를 확산시킵니다.다만 어디에서나 심리상담을 받는다고 되는 것은 아니고, 충분히 전문적인 실력을 갖춘 분을 찾아야 합니다.그 밖에 도움이 되는 내용들이 제 블로그에 정리되어 있으니 참고해 보세요.blog.naver.com/mindstay701자존감결여, 인간발달 항목을 먼저 읽어보면 좋을 것 같습니다."
40,"노래방낙서하세요 아님 음악듣거나스트레스는 삶에서 오는 자연스러를운 현상이나 타인과의 관계에서 오는 감정적 스트레스나 구조적 스트레스를 그냥 두면 몸과 마음이 병들게 됩니다.상황에서 벗어나거나 관계의 단절만이 해결책이나 현실은 그럴수 없는 경우가 많을수 밖에 없죠.저주로써 스트레스를 해소하고 감정적 동등함을 회복하는 기회가 될수 있습니다.  ""이상하게 들릴수도 있지만, 저주는 희생자의 감정적 우울감을 회복시켜주고 무너진 자존감을 되찾아주는 데 효과를 발휘했다"" 저주를 통해 스트레슬르 날려버리고 스스로를 위로하며 자신감을 회복할 수 있습니다."
41,"스트레스해소법좀요ㅜㅜ *스트레스 해소법1,숲을 걷는다;긴장이 완화된다.;스트레스, 우울감이 감소한다.;자기 긍정성이 증가한다.;운동 지속 의지가 증가한다.;만성피로가 해소된다.;충동적 식욕이 감소한다.;혈압이 감소한다.;스트레스호르몬 코티솔이 감소한다.;혈당이 떨어지고 체지방이 감소한다.-출처/조선일보"
42,공왕불 기도추천 드립니다저는 대인관계로 인한 스트레스로 대인기피 불면증 우울증으로 시달리고오래동안 살았습니다. 덜덜 떨고 오늘은 무슨일이 일어날까?하면서하늘이 무너질 것 같은 마음으로 살았습니다.물론 그닥 살고 싶은 마음이 없었구요혼자서 울화가 올라 화를 내고 혼자말도 하고 곱게 미치기 직전이었습니다.그러다 우연히 공왕불기도를 만나서 여러 공덕들을 받았습니다.먼저 마음을 잡아 보세요마음을 잡으라고?? 어떻게? 하고 의문이 생길 것입니다.혼자서는 힘이 듭니다.. 애써 해 보았지만 더 우울감만 깊어졌습니다.공왕불기도를 해보세요..도와주실 것입니다.기적이라는 생각이 들 정도입니다기적처럼 마음이 편안해지고마음을 잡힐것이라 생각이 듭니다.잠깐 기도라도 시작하심 편안한 마음과 잠이 너무 오실겁니다경험담이고 잠을 너무 자도 두통도 업고약물처럼 혼탁한 정신 아니구여세상에 이렇게 편하게 잘 수 있나는 생각이들고기도를 더욱 하시면 그런것 재발업시 생활합니다이상한것도 아니고 돈이 드는 것도 아니고기도 해보고 효염보시고 공왕불 알아보세요ㅡㅡㅡㅡ공왕불기도법ㅡㅡㅡㅡㅡㅡ1. 방향과 장소에 상관없이정좌를 하고 합장을 한다.2. '나마 삳다르마 푼타리카 수트라'를천천히 3번 외우고고개를 숙여 시작인사를 한다.3. '나마 삳다르마 푼타리카 수트라'를빠르게 자기가 외우고싶은 만큼 외운다(속마음으로는진심 자기만의 기원을 한다)4. '나마 삳다르마 푼타리카 수트라'를느리게 3번 외우고마무리기도한다
43,"다 암것도 아닙니다.화이팅!채택부탁드립니다현재의 그런 증상은, 현대병 이라고도 하고, 현대인 이라면 모두가 보편적으로 갖고 있는 정신장애인 신경증(노이로제)의 증상 중 신경증의 증상에 해당하는 증상입니다.ㅍ;ㄹ지의 블그를 발문 하셔서 "" 스트레스 푸는 방법 "" 이란 글을 출력 하셔서, 찹고 하시면, 좋은 결과를 얻을 수 있을 것입니다.이런 증상이 있다면, 조속한 기일안에 정신과전문의의 진료를 받고, 치료에 대한 상담을 하시고, 적극적으로 정신치료를 받아야, 완치가 될 것입니다.그리고 조속한 기일 안에 임상심리전문가로 부터 종합심리진단검사인, M.M.Q(mandsel medical questionnaire), H.T.P(house tree person), Bender Gestalat , Sentence Completion, M.M.P.I(minnesota multiphasic personality inventory), Rorschach, T.A.T(themat apperction test),등의 정밀검사를 받아 보셔서, 증상의 종류와 상태를 자세하게 파악을 하셔야, 앞으로의 정신치료에 근본적인 바탕이 되고, 완치를 하는 대도 큰 도움이 된다는 사실 입니다.이러한 정밀검사로 통해서, 먼저 질병의 증상의 종류와 상태를, 자세하게 파악을 하시는 일이 가장 중요하며, 정신치료를 시작을 하면, 적극적으로 완치가 될 때 까지,정신치료에 정성을 다해서 치료를 하여야 완치가 될 것이며, 약물치료는 하지 말아야 하는데,이런 약물들은 향정신성 의약품들 이고, 이런 약들을 장기 복용을 하면 중독의 위험성과 후유증이 발생하기도 하기에, 복용을 하지 않는 것이 중요하며, 적극적으로 정신치료를 받아야 만, 완치가 된다는 사실을, 이해 하셔야 할 것입니다.정신장애라는 증상은 초기 상태일 때, 적극적으로 치료를 하여서 꼭 완치를 하여야 하며, 이런 때를 놓치면, 점차 증상이 심화가 되어서, 성격장애에서 다음 단계인 신경증으로 발전을 하고, 신경증을 완치 하지 않고 방심을 하면, 정신분열증으로 발전을 하는 것이며, 이런 정신분열증은 초기 상태는 그래도 치료가 가능 하여서,완치에 가깝도록 치료가 되지만, 중기 이상 만성의 상태는 치료가 불가능 하다고 정신과전문의들은 말을 합니다.이렇게 되면 정신과나 정신요양원에 장기 입원을 하여서, 치료보다는 관리를 한다는 마음으로 처리를 하는 것이 좋고, 이런 증상이 막바지에 다 다려서 정신분열증이로 발전을 하게 되면,한 사람의 인생을 망치는 경우가 된다는 사실을, 이해 하셔야 할 것입니다,그렇기에 정신장애라는 증상은 무서운 증상이고, 이런 증상을 방심히지 않고, 적극적으로 정신치료를 받아서, 완치를 하는 것이 정신건강유지에 많은 도움이 될 것입니다.맛있는거 먹어봐요!!^^"
44,"땀 흘리며 운동 하세요여행을 좋아하셨군요~사람은 저마다 가슴 뛰는 일을 할 때 우울감에서 벗어날 수 있어요. 그게 운동일 수도 있고 산책일 수도 있고 여행일 수도 있어도 공통점은 대부분 ""외부 활동""이라는 겁니다.쇼핑을 해서 비싼 걸 사도 가슴이 뛸 수는 있지만 계속할 수는 없잖아요? 그래서 사람들이 대부분 우울감을 해소하기 위해 ""운동""을 하는 겁니다.어떤 운동을 하느냐가 문제인데, 저 같은 경우는 격렬한 운동을 합니다. 적어도 아무 생각이 없어질 만큼 말이죠. 본인이 좋아하는 운동을 찾아보세요. 만약에 돈이 좀 있다면 좀 값나가는 것을 사 보거나 어디 가서 레슨을 받는 것도 방법이 됩니다. "
45,"*스트레스 해소법1,숲을 걷는다;긴장이 완화된다.;스트레스, 우울감이 감소한다.;자기 긍정성이 증가한다.;운동 지속 의지가 증가한다.;만성피로가 해소된다.;충동적 식욕이 감소한다.;혈압이 감소한다.;스트레스호르몬 코티솔이 감소한다.;혈당이 떨어지고 체지방이 감소한다.~조선일보2,한방차를 마신다;인삼은 정신을 안정시킨다.;석창포는 심규를 열어주고 잘 잊어버리는 것을 치료하며 정신을 좋게 한다.;천문동은 정신을 안정시키고 건망증을 치료한다.;복신은 정신을 안정시키고 보양한다.;연밥은 정신을 보양하고 화내는 것을 잊게 한다.3,빨리 걷기를 한다;빨리 걸으면 평소보다 훨씬 빠른 혈액순환이 잘 된다.4,목욕을 한다;정신적인 피로에는 38~41도의 물에 목욕을 한다.명상을 하고 맛있는거  특히 매운걸 먹어요 ㅋ"
46,"저도 별다른 스트레스 해소법이 없어서 크게 도움이 될진 모르겠지만 개인적으로 좋아하는 유튜브 영상을 보거나 노래들으면서 빵댕이 신나게 흔들기도하고 피포페인팅도 우울감 없애는건 괜찮아 지는것 같더라구요. 근데 이것도 가끔은 아무 도움이 안될때가 있어서 그럴땐 자거나 친구를 만납니다우울감이 빠져있으면 아무것도 하기 힘든데 조금이라도 움직여보고 환하게 있고 우울한 생각, 걱정을 최대한 안하려 노력해보면 좋을것 같아요우리 같이 힙냅시다 진심으로요☺️"
47,"몸이 엉망인것 같아도 원인은 고개숙이고 몸이 앞으로 굽어 생기네요 나도 엉망인 몸을 몸살림의 온몸펴기로 펴고 핸드폰은 줄이고 컴은 모니터 높여하고 고개들고 가슴펴고 허리세워 펴진 몸이 되니 점차 좋아졌어여운동법은 내유투브에서 찾으면 되네요 가슴이 답답할때도 같이 보셔요건강에 보탬이 되길 바래요 안녕하세요.질문자님, 스트레스 많이 받으셔서 고민이 많으시겠어요...좀 사소한건 훌훌 털어버리고 단순하게 살면 좋은데 쉽지가 않죠.제 생각에 스트레스 -> 수면부족 ->두통->예민해짐->불안장애, 건망증이런 악순환이 계속 되시는것같은데, 혹시 숙면을 취하시기 어려우신가요?ㅠㅠ제가 찾아보니까 요즘 숙면영양제같은거 저렴하게 잘 나오던데, 아래 함 관심있으면 봐보세요!https://smartstore.naver.com/cecim/products/5389244875숙면 보조제 수면 영양제 잠 잘오는 피로회복제 수험생 뇌에 좋은 뇌 영양제 트립토판 테아닌 감태추출물 락티움 : CECIM[CECIM] 세심하게 챙기는 라이프스타일샵smartstore.naver.com운동으로 몸과 마음도 다스려 보시지요.안내를 보시고 조금이라도 도움이 되어 생기가 나고 스트레스를 풀면 좋겠습니다.우선 현재 받고 있는 스트레스를 해소 하는 것이 급선무입니다.스트레스나 우울증은 생각으로 푸는 것이 아니고 행동으로 풀어야 합니다.안내 드리는 혈액순환을 좋게 하는 운동을 시작해서 생기를 되찾고 활력이 나는 운동으로진전시켜 스트레스를 해결 하는 노력을 하시면 좋겠습니다.  질병으로서의 스트레스는 주로 사지의 정맥근펌프 작용인 운동 부족과 체액의 오염이 방아쇠가 된 것이라고 생각하면 됩니다.스트레스로 인해 심리적으로 자신감이 떨어지고 위축되어 있으면 몸도 경직되어 버립니다.그렇게 되면 순환이 부진해지면서 호흡이 얕아지고 신체감각이 둔감해지면서 인식능력, 판단력까지 떨어지게 되는 관계로 현재 겪고 있는 질병들이 갑자기 발생하게 되는 단초가 됩니다.  갑자기 찾아든 질병들 때문에 놀라고 더욱 긴장하게 되어 건강이 점점 악화됩니다. 하지만 호흡을 이완시키고 근육을 움직여 혈액순환을 좋게 해주는 운동을 하면 자신에대해서 이전보다 풍부하게 느낄 수 있게 되고 갑자기 찾아온 질병을 물리칠 수 있게 됩니다. 운동은 엔도르핀(endorphine) 호르몬의 분비를 촉진하여 우울증 불안감 등을 해소하고 근육긴장을 완화시키며, 신체기능을 떨어뜨리는 호르몬의 배출도 돕는 것입니다. 또한 운동은 자신감을 가지게 하고 감정을 조절하고 긍정적인 사고를 도와주며 건강을좋게 하여 우울감과 스트레스를 해소할 수 있는 힘을 길러줍니다.우울증은 숙면을 하면 80%는 나을 수 있는데 혈액순환을 좋게 하는 운동이 숙면의 기초입니다.낮 시간대의 운동은 수면의 질도 좋게 하고 우울증을 날려버릴 수 있습니다.우울하다면 머뭇거리지 말고 지금 당장 밖으로 나가서 운동을 시작하셔야 합니다.  운동은 자신에게 맞는 운동방법을 찾아 한 가지만 하지 말고 요일에 따라 다양한운동을 즐길 수 있도록 프로그램화 하는 것이 좋습니다. 운동은 남는 시간에 하는 것이 돼서는 안 되고 최우선순위에 두고 매일 해야 하고여건이 되면 그룹으로 하는 운동을 하는 것이 더 좋습니다. 위에 있는[하루10분 평생 건강] 네임카드의 오른쪽(중앙부분)에 있는 홈페이지를 클릭, 고객체험사례 클릭,<제목 + 내용>에서 [스트레스, 우울증, 불안감, 숨차는, 공황, 혈액순환 등]을 검색하여 다양한 사례들을 참고 해보세요.(발목펌프운동의 원리와 운동방법 등)<참고>장기간 계속되는 코로나와 더위 그리고 추위가 이어지면서 활동(운동, 외출 , 걷기 등)이 많이 부족해지면서 혈액순환이 부진한 것이 원인이 되어 비슷한 증세를 호소하는 사람들이 많이 늘어나고 있습니다. 최근의 생활습관과 안내 드리는 내용을 비교해 보시고 활동이 많이 부족했다고 생각 하시면 안내 드리는 운동을 활용해 생기를 찾아보세요.급격한 스트레스나 운동 부족 등으로 인해 근육과 혈관이 경직되면 혈액순환이 갑자기 나빠지게 됩니다.그런 원인으로 혈액순환이 부진하게 되면 적혈구가 포도송이처럼 뭉쳐져 산소 공급이 정상으로 이루어지지 않아 짜증, 불쾌한 증상이 나타나고 숨이 가쁘고, 숨쉬기가 어려워지는 증세, 불안감, 어지러움, 우울증, 두통 등이 갑자기 발생하는데 순환을 호전 시켜주면 이런 증세는 자연치유 되기 때문에 순환을 호전 시키는 것은 필수입니다. 또한 코로나 바이러스나 미세먼지 차단 율이 높은 마스크를 장시간 착용하면 숨쉬기가 힘들어지고 숨을 쉬면서 내뱉은 이산화탄소를 다시 들이마시게 되면서 체내 산소부족영향으로 오는 호흡불편은 인체에 부정적인 생리작용을 유발 할 수 있습니다.  힘내시길 바래요"
