ㄹ,0
76,"스트레스 운동으로 몸과 마음도 다스려 보시지요.안내를 보시고 조금이라도 도움이 되어 생기가 나고 스트레스를 풀면 좋겠습니다.우선 현재 받고 있는 스트레스를 해소 하는 것이 급선무입니다.스트레스나 우울증은 생각으로 푸는 것이 아니고 행동(운동)으로 풀어야 합니다.안내 드리는 혈액순환을 좋게 하는 운동을 시작해서 생기를 되찾고 활력이 나는 운동으로진전시켜 스트레스를 해결 하는 노력을 하시면 좋겠습니다.  질병으로서의 스트레스는 주로 사지의 정맥근펌프 작용인 운동 부족과 체액의 오염이 방아쇠가 된 것이라고 생각하면 됩니다.스트레스로 인해 심리적으로 자신감이 떨어지고 위축되어 있으면 몸도 경직되어 버립니다.그렇게 되면 순환이 부진해지면서 호흡이 얕아지고 신체감각이 둔감해지면서 인식능력, 판단력까지 떨어지게 되는 관계로 현재 겪고 있는 질병들이 갑자기 발생하게 되는 단초가 됩니다.  갑자기 찾아든 질병들 때문에 놀라고 더욱 긴장하게 되어 건강이 점점 악화됩니다. 하지만 호흡을 이완시키고 근육을 움직여 혈액순환을 좋게 해주는 운동을 하면 자신에대해서 이전보다 풍부하게 느낄 수 있게 되고 갑자기 찾아온 질병을 물리칠 수 있게 됩니다. 운동은 엔도르핀(endorphine) 호르몬의 분비를 촉진하여 우울증 불안감 등을 해소하고 근육긴장을 완화시키며, 신체기능을 떨어뜨리는 호르몬의 배출도 돕는 것입니다. 또한 운동은 자신감을 가지게 하고 감정을 조절하고 긍정적인 사고를 도와주며 건강을좋게 하여 우울감과 스트레스를 해소할 수 있는 힘을 길러줍니다.우울증은 숙면을 하면 80%는 나을 수 있는데 혈액순환을 좋게 하는 운동이 숙면의 기초입니다.낮 시간대의 운동은 수면의 질도 좋게 하고 우울증을 날려버릴 수 있습니다.우울하다면 머뭇거리지 말고 지금 당장 밖으로 나가서 운동을 시작하셔야 합니다.  운동은 자신에게 맞는 운동방법을 찾아 한 가지만 하지 말고 요일에 따라 다양한운동을 즐길 수 있도록 프로그램화 하는 것이 좋습니다. 운동은 남는 시간에 하는 것이 돼서는 안 되고 최우선순위에 두고 매일 해야 하고여건이 되면 그룹으로 하는 운동을 하는 것이 더 좋습니다. 불면증불면증의 원인은 많습니다. 수많은 원인 중에서 혈액순환 부진이 가장 일반적인데 혈액순환을 호전시켜 주는 방법으로불면증을 해결하면 성공률이 높습니다.  우주비행사가 우주여행을 하기 위해 무중력 공간에 들어가면 하지에 모여 있던 체액(혈액, 조직액, 임파액 등)이 중력의 영향으로부터 해방되어 전신에 균등하게 분산된 결과 머리, 상반신에 부종을 일으키게 됩니다.  하루 종일 서서 생활하다가 바로 누워 잠자리에 들면 중력현상에 의해 발과 종아리에담겨 있던 더러운 체액이 비어 있는 공간인 머리를 돌게 되는데, 이때 제일 섬세한 뇌의 세포가 더러운 체액으로 인해 비명을 지르게 되는 불면증이 초래됩니다.  그래서 잠자리에 들기 전에 신장을 활동시켜서 이 노폐물을 강력하게 여과 정화시켜 맑고 깨끗한 체액으로 머리를 채우면 숙면을 할 수 있습니다. 낮에 활동하는 동안 직립자세에 의해 생긴 발의 부종을 없애고 나서 취침을 해야 합니다. 잠자리에 들기 전에 발목펌프운동을 짧은 시간 하면 매우 많은 혈액을 필요로 하는 뇌의 혈액순환을 호전시켜 체액을 깨끗하게 하는 좋은 역할을 합니다.불면증으로 오랜 세월 고생을 했는데 이 운동을 처음으로 하다가 잠이 들었고 깨어보니 아침이었다는 사례도 있으니 적극 활용해 보시지요. 추가로 햇빛은 비타민D 합성을 돕고 신경전달물질인 세로토닌을 생성하는데 세로토닌은 기분, 수면, 기억력, 식욕 등에관여를 하고 세로토닌이 감소하면 숙면을 취하기가 어렵게 됩니다.낮에 햇빛을 많이 받아야 밤에 멜라토닌을 최대로 분비해서 숙면을 하게 됩니다.이런 점을 감안해서 되도록 햇빛을 많이 받는 활동도 하시고 여의치 않으면 비타민D를 복용해서 불면증에서 벗어나려는 지혜도 필요한 것입니다. 그리고 불을 켜거나, 전기기구 등에서 빛이 많이 발생하거나, 커튼을 쳐도 외부로부터 들어오는 빛이 있으면 불면의 원인이 되어 침실의 환경도 점검을 해보는 것이 필요합니다. 잠을 자야 하는 시간대에 위와 같은 이유로 빛이 차단되지 않고 휴대전화 컴퓨터 등으로 빛의 자극에 많이 노출되면 멜라토닌이 분비되는 시간이 늦어져 쉽게 잠들지 못하고 숙면이 어려워 적극 고려해야 할 사항입니다. 위에 있는[하루10분 평생 건강] 네임카드의 오른쪽(중앙부분)에 있는 홈페이지를 클릭, 고객체험사례 클릭,<제목 + 내용>에서 [불면, 숙면, 두통, 스트레스, 혈액순환 등]을 검색하여 다양한 사례들을 참고 해보세요.(발목펌프운동의 원리와 방법 등)https://www.youtube.com/watch?v=9KbgONSZiRc제가 몇가지 체크사항을 보여드리겠습니다.1. 입면 하기 힘듦 (수면 개시 장애)2. 잠들어도 자주 깸 (수면 유지장애)3. 새벽에 일어나 잠을 설침 (수면 유지장애)4. 잠자기 전 생각이 많음 (수면 개시 장애)5. 온/습도가 안 맞게 느껴지고 뒤척여도 잠이 안 옴 (수면 개시 장애)6. 잠들어야 한다는 압박감이 들고 잠을 못 들면 어떻게 하지라는 부담과 불안감을 느낌 (수면 개시 장애)수면에 질을 높히시려면 온/습도에 예민하실수도 있고 소리에 예민하실수도있습니다. 마그네슘 / 자기전 바나나 / 따듯한 우유한잔 / 평소에 물도 많이드시고 오글거리고 힘드실지모르시겠지만 아침에 눈떳을때 10~20분정도 유튜브에서 아침명상을 해보시는것도 규칙적인 생활 패턴을 잡는것에 매우 효과적입니다.그럼 오늘 하루도 고생 많으셨고 어떤 일이든 다 지나가기 마련이니 지금 머리 아프지 마시고 주인공은 나 자신입니다. 편안한 밤 되기실 바랍니다.""이 포스팅은 쿠팡 파트너스 활동의 일환으로, 이에 따른 일정액의 수수료를 제공받습니다오늘도 꿀잠 자는 나를위해더이상 상처주지 않아요 이젠 마음 편히 쉬어요 더이상 힘들어하지 않아요 이젠 마음 편히 쉬어요 정직한 리뷰와 실사용 후기 냉정한 T로서의 판단 오늘도 찾아주셔서 감사합니다 :)linkon.id불면증과 숙면, 신경안정에는 영지버섯이 많이 이용되고 있습니다.영지버섯 불면증 이용후기◆ 영지버섯은 천연수면제입니다. 수면의 질이 미친듯 좋아지고 기미도 옅어지고 막 뭔가 되살아나요. 잠이 보약인거 아시죠? 잠 잘자니 모든 면에서 다 건강해진 느낌이에요.◆ 수면에 도움이 많이 되는것 같아 자주 시켜 먹습니다~◆ 밤에 잠을 깊게 잘수 있네요.◆ 잠이 잘 오고 땀이 덜나서 매일 먹고 있어요. 건강에 도움이 됩니다.◆ 불면증에 좋아요. 지금 몇번째 재구매중입니다.◆ 몸에 땀이 많이 나는걸 조절해 주는 효과가 있네요. 밤에 잠을 더 깊게 숙면을 취하게 하는 효과도 있네요.◆ 제가 불면증이 있는데 매일은 아니라도 일주일에 4번 정도는 쭉 잘자요.◆ 더위를 많이 타고 잠을 잘 못잤는데 영지버섯 복용후 여름에 땀도 덜나고 잠도 잘자요.영지버섯 이용후기 출처: 버섯이야기문상영 유기농 영지버섯 진액 : 버섯이야기문상영 유기농 영지버섯, 영지버섯 효능, 영지버섯 먹는방법, 영지버섯 보관법, 영지버섯 가격, 영지버섯 먹는법, 국내산 영지버섯, 영지버섯 판매, 영지버섯 차, 영지버섯 진액, 영지버섯 액기스, 영지버섯 물, 영지버섯 즙, 영지버섯 절편, 영지버섯 선물, 영지버섯 선물세트smartstore.naver.com"
78,"심리상담이 절실해보입니다 . . .심림 상담가에게 상담받아보심이 좋을거 같아요!자각하고 계신거보니 치료가능성이 높습니다..정신검진한번받고 진료받으세요심한 우울로 정신과 1년째 다니고있어요 요즘 새벽에 창문열고 바깥을 쳐다보며 밤 공기 마시는게 힐링되더라고요  > 정상근데 지나가는 차,버스,사람을 아무생각없이 빤히 쳐다보게 돼요 > 정상 손도 흔들고싶고 소리지르고 싶어져요 > 이건 스트레스가 보입니다. 노래방 가셔서 소리지르면서 노래부르시는거 추천합니다.2층이라 안죽는거 뻔히 아는데도 확 창문을 넘어가 떨어져보고 싶기도 해요 > 호기심 + 궁금증 하지만 안죽지만 아픕니다. 지나가는 사람 보면 그 사람이 사라질때까지 계속 쳐다봐요 그 사람이 뒤돌면 저는 숨고 다시 쳐다봐요 진짜 긴장감들고 재밌더라고요 어린아이처럼 계속 웃으면서 사람들을 빤히 바라봤어요 > 이건 작성자분께서 자신만의 스트레스 해소법으로 설정하신거 같은 데 유아성 행동으로 다른 환기점을 찾아보셔야할 듯합니다.버스 보는것도 재밌더라고요 누가 타고있나 사람 많나 하면서 계속 보는데 어린아이가 된 것 같았어요 > 평소에 구경하는 거나 사람들을 관찰하는 것에 있어서 성장과정에서 어딘가에 고립된 적이 있나 살펴보시길 바랍니다. 보통 성장과정에서 결핍된 곳에서 발생하는 부분이 많으니까요.보통 이런분에게는 생태계적이나 동물 관찰하는 직업류가 딱 입니다. 보통 이런 스트레스 해소하는 걸 개미 키우는 걸로 대체하시면 될 듯합니다."
79,"규규엄마가 40대후반오십초반으로폐경기가 온거라면 더더욱 스트레스.우울감이 심해집니다폐경때문이 아니라도 스트레스는 위장병도 잘생기게하구요동생깨우다 혹시 아침부터 다투게되면엄마 스트레스가 더오를수있겠죠?동생이랑 먼저얘기해요엄마 건강이 걱정되니 깨울때 딱 일어나라고요그얘기들음 아무리 철없는동생이라도엄마생각해서 일어날거에요기특하네요~~^^운동을 안하시면  동네 산보하는코스 걷게하는것도 굉장히 큰도움되요  또 키우기쉬운 꽃이피는 화초나 다육이같은거 키우는것도  마음의 안정을 취해서 스트레스해소되구요화초키우는 엄마들이 다 이유가있는거에요저역시 화초키우면서 꽃멍하면서 힐링하거든요엄마가 취미생활을 하시면 스트레스해소에 아주 좋아요댄스,탁구, 등산, 요리등 취미생활을 하시면 집에서 쌓였던 스트레스가확 풀립니다~~네 많이먹고 많이자고 많이운동하고  그리고 건강식품도 드시구요 효녀네요 ㅎㅎ  엄마를 생각하는 마음이 참이쁜딸이네요 ㅎ"
80,"일에만 집중직업상 마음이 힘드시거나 약을 복용하시는 분들을 많이 접하게 됩니다. 긴장이 반복되고 스트레스가 지속되니 악순환이라고들 말씀하십니다..저는 개인적으로 운동을 추천드립니다.테니스나 필라테스 처럼 자세와 공에 집중해야하니 우선 잡생각이 사라지고 적당히 땀도 흘리고 운동도 하니 스트레스도 풀려 저는 운동으로 스트레스 해소를 하고 있습니다:) 이겨내지 못해도 괜찮습니다.쉽진 않지만 소소하게 나마 취미를 만들어가며 즐겁게 살아주셨으면 좋겠습니다!질문자님을 뵙게 되어 감사드리며당신의 맘을 카운슬링하는 심리상담 엑스퍼트 힐링상담사 입니다.현재 심리 / 연애 / 라이프 코칭 분야 엑스퍼트 전문가로서 답변드립니다.----------------------------------------------------------그 동안 혼자서 힘든일들이 많았던거 같네요.그로 인한 걱정과 스트레스로 결국 불안장애까지 견디면서우울감에 지치고 힘들어 했던거 같아요.그로 인해 지금은 질문자님께서너무 무너진거 같네요. 그로 인한 아픔을 지금 겪고 있는 만큼너무 힘드신거 같네요. 그 만큼 너무 괴로우셨을만하네요.아래 심리상담하기로 문의 주셔요.무료로 봐드릴께요.--------------------------------------------------------------------------------------------------------------------질문자님 추가로 더 궁금한 점이나 고민이 있으시다면 아래 버튼↙을 눌러주세요.▶심리상담하기Click(채택으로 얻은 하나의 콩)은 모두 (아동청소년)을 위한 기부에 쓰이고 있으며해피빈 기부 활동내역은 블로그에 업데이트 하며 활동하고 있습니다.▶공부책이나 동영상을 볼때 꼼꼼하게 보지 말구요.잡지보듯이 대충대충 훑어본다는 생각으로 여러번 읽으세요.모르는 내용이 있어도 그냥 넘어가세요 그렇게 책과 친해지면 됩니다.낯설은 사람도 한번에 친구될 수 없잖아요집중이 안되고 중간에 딴짓을 했더라도 포기하지 말고 정해진 시간까지는 앉아있는 연습을 하세요그리고 큰흐름을 볼수있게 덩어리로 생각하는 연습을 하세요https://youtu.be/62eUKjtE3Dg=============================================▶인간관계나의 의지로 바뀔수 없는 부분은 내가 걱정한다고 해결되는 것이 아닙니다. 그냥 흘러가게 두시고 님에게 주어진 일에만 집중하세요.님이 범죄를 저지른것이 아닌데 님을 싫어하고 따돌리는 사람이 있다면 그것은 그 사람이 감당해야할 운명입니다. 그사람들은 나중에 알아서 그에 따른 대가를 치를거예요사랑을 받는 사람보다 주는 사람이 행복한 사람입니다.사랑받기 위해서 애쓰지 마세요.책을 많이 읽고 힘을 기르면 사람들은 알아서 달라 붙게 되어 있습니다.님을 돕는 것이 남을 돕는것입니다.님이 남을 자꾸 신경쓰고 두려워하면 상대방도 불편함을 느낍니다.님이 남을 신경쓰지 않으면 남도 님을 신경쓰지 않습니다.님이 좋아하는 것들만 신경쓰기에도 인생이 짧습니다.남의 눈치를 보고 남을 신경쓰느라 남의 인생을 살지 마세요.어짜피 뿔뿔이 흩어질 인연입니다.님에게 주어진일에만 신경쓰시고 님이 좋아하는 것에 대해 구체적으로 상상해 보는 연습을 하세요.그래도 친구관계가 신경쓰인다면,친구들을 조건없이 돕는다(덕을 쌓는다)는 생각으로 만나세요.아래 영상이 도움이 될거예요https://www.youtube.com/watch?v=USbq08YgmzY=============================================▶우울증+불안증님이 생각하는것, 보는 것, 듣는 것, 만나는 사람이 님의 정체성을 만들어 갑니다.롤모델 , 좋은 책, 좋은 영화나 음악, 좋은 친구...게임을 하루종일 하면 게임같은 인생이 됩니다.멋있는 그림에 대해 생각한다면 멋있는 예술가가 될겁니다.님이 좋아하는 것들만 신경쓰기에도 인생이 짧습니다.선물을 주듯이 님에게 좋은 것들만 주는 연습을 하세요.-----------------------------------------------------------------------집안 정리를 깨끗하게 하셔야 좋은 기운이 생깁니다.물건을 쌓아두지 말고 안쓰는 물건은 과감하게 버리세요.님이 머무르는 공간이 곧 님의 마음상태를 보여줍니다.-----------------------------------------------------------------------어떤사람은 운동신경이 좋은 사람이 있습니다. 어떤 사람은 저질체력을 갖고 태어납니다. 하지만 저질체력이라도 꾸준히 노력을 하면 좋은 운동신경을 갖게 됩니다. 정신근육도 단련이 되면 튼튼해 집니다. 마음이 힘들때는 습관처럼 '힘들어서 감사합니다. 저는 성장하고 있습니다.'를 항상 되뇌이면서 불쾌한 느낌도 받아들이는 연습을 하세요 그래야 천천히 변화가 일어납니다우울증이나 불안증 혹은 님의 의지대로 고쳐지지 않은 어떤 감정이 님이 싫어하는 사람이라고 해봅시다.그것을 좋게 하는 방법은 불안한 느낌을 인정하고 껴안아 주는 것입니다.싫어하고 두려워하고 걱정하면 좋아지지 않습니다. 꿈에 귀신이 나오고 악몽을 꾸더라도 ""감사합니다. 나는 이런 느낌도 인정합니다."" 이렇게 생각해 보세요.웃긴 이야기 같지만 불편하다고 생각되는 느낌을 무시하지 말고 사랑해 주면 그때부터 서서히 기적이 일어납니다. 그런데 님이 ""이건 우울증(불안증)이야, 두려워, 없어졌으면 좋겠다""라는 판단을 하면 좋아지지 않습니다.불안이나 우울도 님의 일부입니다. 회피하거나 억누를수록 더 커집니다. 불안이 올라오면 그대로 관찰하는 겁니다. 힘들면 천천히 호흡을 하면서 들숨-날숨에 집중하세요오히려 '더 불안해보자, 우울해보자'라고 생각해보세요. 그러면 반대의 현상이 나옵니다. 불안을 억누르면 더 커지고, 불안을 기꺼이 느껴보게 되면 작아지게 됩니다.우울증이라는 바람속에서 조용하게 지켜보면서(무시하지말고) 님에게 주어진 일을 하면 됩니다. 우울증이라는 바람이 님을 통과하고 있는 것입니다.불쾌한 느낌이 들때마다 주문을 외우듯이 항상 '감사합니다'고 말하는 연습을 하고'내가 이런생각을 하고 있구나' 하면서 그냥 흘러가게 두세요. 집착하지도 말고 없애려고 하지도 마시구요.공부도 한방에 잘할 수 없습니다. 근육도 하루아침에 생기지 않습니다. 조급함이 사람을 망하게 합니다. 님이 우울이나 불안을 거부하지 않고 감사하게 느끼고 있을때 우울함이나 불안함이 없어질 겁니다.바다에 파도가 없기를 바랄수는 없습니다. 하지만 어떤 사람은 작은 파도에도 허우적 대는 사람이 있습니다. 타인의 노력으로 고칠 수 없는 불쾌한 느낌에게 감사하는 연습을 하면 님은 인생의 파도를 즐길줄 아는 서퍼(surfer)로 보다 발전된 인생을 살게 됩니다.위기라고 생각할 수 있지만 그 안에는 선물이 들어있습니다. 우울증을 통해서 님이 그 선물을 찾아내셨으면 좋겠네요.더 좋은 세상을 만들기 위해 님이 태어난 이유가 있습니다.감사함은 모든 두려움을 이기며 내 마음이 평화롭게 변하면 나를 둘러싼 현실도 변하게 됩니다.===========================================▶절을 하세요지푸라기라도 잡고 싶은 심정이라면 절을 하세요절을 하시면 구설수나 인간관계 등 여러 인생 문제가 해소 됩니다절하는 영상 찾아보시고 절을 꾸준히 하세요오늘 절을 하면 내일의 상황이 나아지고 내일 절하면 모레의 상황이 좋아집니다https://youtu.be/hvAjy_EXoIU절을 하다가 허리가 아프거나 속이 울렁거리면 짜게 드시고무릎이 아프면 꿀이나 흑설탕을 드시면 됩니다"
81,"안녕하세요. 하이닥-네이버 상담 한의사 노영주입니다.살다 보면 누구나 그런 생각이 들 때가 있습니다. 많이 힘들 땐 실컷 울어보는 것도 좋은 스트레스 해소법입니다만 그것만으로는 긍정적인 기분을 회복하긴 어렵죠. 심적, 정신적 불안과 강박과 스트레스만큼이나 이유 없는 우울감은 삶의 의욕을 꺾습니다. 때로는 이 때문에 우울증 약을 복용하시는 분들도 있는데요. 치료까지는 생각하지 않고 계시는 상황 같습니다. 먼저 마음에 꽉 찬 우울을 내보기 위해서는 마음의 빈 공간, 여유를 찾아야 합니다. 그 여백을 감사로 채워 보세요. 하나하나 아주 사소한 것들에 감사하다 보면, 나에게 주어진 많은 것들이 보일 것입니다. 산책, 명상, 음악, 운동, 독서, 레저활동 등은 기분을 쉽게 전환할 수 있도록 도와줍니다. 본인에게 맞는 것이 무엇인지는 천천히 찾아 보시면 좋겠습니다. 짧은 답변이지만, 도움이 되었길 바랍니다."
82,"1. 내가 사는 곳인 XX에서 주변 학원가에서 한 학생이 성폭행을 당한 뒤 우울증을 앓다가 ㅈOㅅO을 했던 일이나 옆 아파트에 사는 한 남자가 우울증을 앓다가 ㅈOㅅO을 했던 일도 있었다. 이처럼 ㅈOㅅO 문제는 그다지 멀지 않은 곳에서도 찾아볼 수 있다.In XX, where I live, a student was sexually assaulted and committed suicide while suffering from depression and a man living in an near apartment Like this, the issue of suicide can be found not far away.  >> In XX, where I live, a student was sexually assaulted and committed suicide while suffering from depression. And a man in a nearby apartment ended his own life succumbing to depression. Like these, the suicide cases are found in our neighborhood.   2. 예를들어, 학생의 ㅈOㅅO 사건이 있었던 이후로 우리 학교에서는 스트레스 해소법과 관련한 강의를 듣게하고 일주일에 하루, 한 시간씩 일찍 끝내주며 각자의 방식으로 스트레스를 해소하는 시간을 갖을 수 있도록 해줬다.For example, since the student's suicide, our school has allowed us to take classes on how to relieve stress. And one day a week finshing school an hour earlier, allowing us to take time to relieve stress in us own ways. >> For example, since the student attempted suicide, our school has had us take classes on how to relieve stress. The school also arranged to finish school an hour early per week so that we can have time to relieve stress on our own way.  3. 내가 다녔던 학교에서도 이를 위해 한 달에 한 명씩 뽑아 그 친구에게 괜찮니 무슨일 없니하고 묻게 했다. 대화뿐만 아니라 친구에게 몰래 작은 도움을 주고 기록하게 하기도 했다. 또 친구가 큰 고민을 갖고 있다면 선생님에게 알릴 수 있도록 지도했다.In school where I graduated, we picked one friend a month and we ask a friend “Are you okay?” or “How have you been doing?” in every morning. Not only did ask to friend, but we also secretly give a friend a little help and record it. Also, if a friend has a big problem, we can let the teacher know. >> The school I attended had set up a program in which we chose a friend and called or met him to make sure he was okay. On top of that we were suppose to provide secret help to him and write it down.  And in case he had a problem, we were to report it to the teacher.  4. 하지만 내가 겪었던 ㅈOㅅO 사건에 대한 기사가 나왔을 때, 주민들이 자극적인 제목을 가진 기사에 대해 수정을 요구했지만 수정이 이루어진 경우는 드물었다. 주변에서 일어난 ㅈOㅅO 사건과 관련한 기사를 볼 때마다 주민들은 트라우마에 시달리게 되고, 비슷한 문제를 겪고 있는 사람들에겐 더 큰 우울감을 안겨줄 수 있다.However, while neighbors have asked for revisions to articles with provocative titles about suicide cases that I went through, revisions have rarely been made. Whenever people see an article about a suicide incident around them, they are traumatized. And it can cause more depression for people with similar problems. >> But the media rarely respond to the people’s call to do away with provocative titles for suicide articles, as far as I know. These suicide reports traumatize people around us and they may worsen the depressive feeling of those who are in the similar situation as those who committed suicide.  번역을 수정하는 일에 익숙치 않으므로 나의 번역을 첨부하오니 비교하여 보시기 바랍니다.  도움이 되었기를 바랍니다."
