review,cluster,action_cluster,sentiment_score
 기념일 여행 다녀왔당동대구로 사실 집 가는 느낌이라 감흥 없었는데누구보다 재밌게 놀다 옴 머쓱 먼저 도착해서 케이크 픽업 호텔 먼저 체크인 훙이 데리러가기계획은 완벽했는데 대구에 비가 겁나 오고 양말 신발이 젖어서 발이 까지고 짐 많은데 우산까지 들어서기분이 급격히 가라앉았다 경산까진 흐리기만 했는데 왜 그 상태로 만나서 만복이 갔다 걸을 수 없어서 버시 타기로 귀여운 만복이 종이컵 만복이는 늘 마싱다 왠지 새우튀김 안 땡겨서 우동 시켰는데 어린이 메뉴였음 일단 밥 묵고 방에 가서 짐 두고 후식으로 헤이차일드 나는 자두랑 체리크림이랑 레몬훙이는 레몬이랑 발로나초코 천도복숭아 의외로 초코맛이 진짜 맛있었다 고급진 맛난 체리 좋은데 민초급 호불호라는 칭구 언니가 옷이랑 가방 빌려줘서 사진 많이 찍어오겠다 약속했는데야속한 비 때문에 호텔 거울로만 그치만 이 코디 그대로 또 외출할 거라서 괜찮다 직장인은 기절하고 난 대구KBS 독립영화관 즐겼다영진위 최근에 애증관계 돼서 그냥 찍음 시작 전에 감독님과의 대화 이런 거 해주던데첨부터 봤으면 더 좋았을걸 그래도 이렇게 지상파에서 독립영화 상영해주니까 좋다 애비규환생각해봉께 진짜 독립영화 중에선 코미디가 잘 없는 것 같기도 하고코미디인데 나름 하고 싶은 말은 다 하는 영화 같아서 맘에 들었다 맹한 남주도 귀엽고 수정쒸 연기 하이킥 이후로 처음 봤는데 괜찮았고 뭣보다 찬실씨가 남주의 태평한 엄마로 나오는데 반가워죽음 이튿날조식 먹겠다는 결심은 당연하게 실패하고 미드웨이 이전에 순재랑 와본 김광석거리는 웨딩샵들뿐이었던 것 같은데구석구석 카페랑 뭐가 많아서 자연광 밑에서 지갑 하나 찍어주고요원래 바리바리충이라 카드지갑형 지갑 뭔가 공간 작은 그런 거 안 사는데디자인에 돌아서 사고 깨달았다 뭐 많이 안 들어가긴 하지만 쓰는 카드는 정해져 있으니 괜찮겠 하하하 해더지갑 볕 좋구만 근데 넘 더웠음 모자 써서 더더욱 아침 대신이니까 스콘 아아 종류 안좋아하면서 왜 아인슈페너 시켰을까라떼 맛집 라즈베리 스콘 맛집나머지도 괜찮긴 하다 귤일까 유자일까 뭘까 우정쒸 반갑다 프라이탁 구경하려 했는데 주말엔 예약해야한대서걸어놓고 이리저리 구경했다시장도 보고 구석구석 다녔는데 진짜 너무 더워서 보땀이 되벌임 도저히 못 참고 콘라트법랑 컵 너무 귀엽고 저 티백 진짜 넘 내 꺼 재질이라 이름 조사해옴 진즉 들어올걸 시원해 반스돌이들 부기한테 선물받은 기염티 코디 약간 새로 도전해본 서타일인데 칭구들이 좋아했다나도 맘에 들었움 힙돌이인 척 가능 몰래 올려보는 훙이 사진 귀여워 삼덕 넘어가는 길에 본 멋진 풍갱포토 바이 갤럭시훙 대구 온 젤 큰 이유 피닉스빠볶음밥까지 욕심내려다가 배부르길래 참아줬다 오랜만이어도 맛있어부산에도 생겼으면 싶다가 대구에서만 즐기고 싶다가 대구 그립군 날은 밝았지만 애플와치 본다고 동대구 넘어갔다신세계 슥 돌고 아스크림 먹으러 슝 연화 냥이 밖 구경한다 전에 북이랑 시간 안돼서 못 왔던 심플책방 왔는데진짜 보물창고 찾은 기분이었다일본 시티팝 노래 나오고 감성도 딱 내가 좋아하는 그 느낌 그대루쿨쿨 자는 냥이도 둘이나 있고 아무튼 증말 조아까무러침 전에 훙이가 선물해준 목도리가 필요한 밤 작가님 작품도 잔뜩 뭣보다 이게 너무너무 맘에 들어서 사장님께 여쭤봤는데 단종이라하셔서 울었다 즘맬 근데 인터넷 뒤져서 구했음 의지의 버응 깔깔 깔 언니가 좋아할 것 같은 책이랑다음에 살 무라카미 하루키 책 저장저장 취한다 취해 자던 냥이 하나가 깼다 나가도 다시 돌아온다고 문 열어도 괜찮다고 하셔서 같이 쏠랑 나왔다 또 헤이차일드 토요일이라 그런가 사람이 꽤 있어서 갖고 나왔다여긴 콘 컵 과자도 맛있어 후아 넘 좋아 진짜 대구 갈 때마다 꼭 가야지 만원 이상 구매하면 저렇게 영수증 뒤에 각인쿠폰 새겨주신다 각인 괜찮으세요 물으셔서 네네 했는데 저렇게 감성 있게 주시다니타자기 타닥타다다닫 고양카페 책은 내가 골라서 들고 갔는데 다른 코너에서 똑같이 고른 짝꿍이 보고 신기했다 취향 같아서 잘 노나보다 아 진짜 평소에 걸음 걷다가 집에만 있어서 너무 힘들었어 주년 아님 주년 기념 미리 축하했다 오케이크무화과랑 말차마틸다열심히 찾고 열심히 가서 산 거였는데 맛있어서 행 복 안달아서 좋은 무화과랑 달아서 좋은 말차마틸다 근데 커피 없이 밤늦게 먹었더니 목맥혀서 남김 밀가루 먹고 입터져서 한 시에 치킨 시키니마니하다가더 맛있는 아침을 위해서 참고 잤다 사실 안자고 걸스플래닛 봤다경쟁 너무 싫고 누군가는 떨어져야하는 거 맘 아파서 안 보고 싶었는데훙이가 튼 거 한 편 보고 과몰입하다가 시에 잠 휴 일요일 애리스커피스탠드 점심 먹기 전에 가벼운 카페인타임 라떼맛집 초코칩맛집 아아는 내 꺼 아니라서 맛 기억 안 남동대구 사람들은 좋겠따 이런 거 맨날 마실 수 있어서 걸어올 땐 안오다가 갑자기 엄청 쏟아지기 멘야로지 탄탄멘은 나한텐 좀 어려운 맛이었고 라멘고기밥은 만족만족 웨이팅 없길래 카페 더 있다가 갔는데딱 우리 이전에 만석된 것 같았따 타이밍 참 허허그치만 두런두런 이야기함서 기다림사장님이 오래 기다리셨다고 사이다 주심노래 플레이리스트 넘 좋아서 검색 열심히 하다 옴 시간이 애매하게 남아서 신세계 탐방 주말백화점이니까 당연하긴 한데 갤럭시스토어 갔다가 없는 기도 다 빨리고 했다 플립 다덜 탐내네 같은 기차 못타는 속상함 뒤로 하고 추석을 기약하며 안녕했다 오는 차에서 편지 읽었는데 너무 깜찍해서 눈물이 다 났어 기복이 심한 날 잘 컨트롤할 수 있는 것이 고맙다같이 내려갈 수도 있는 건데 그러지 않는 것이 고맙다 오래오래 잘 지내자꾸나 운식님 델다주러 온 집니랑 같이 귀가하고 기절 자기 전에 밀리의 서재로 집주인할머니와나마무리까지 맘에 드는 주말내일 쉬어서 더더욱 그런듯 깔깔 월이 코 앞이구나 하반기도 핫틩 ,0,1,0.7241379310344828
동국대학교서울캠퍼스이해랑예술극장 알앤제이 R J 조은솔 강영석 구준모 최호승 영석 줄리엣 보러 왔어 너무설레 즌머씌랑 홋은 벌써 네번째 전 공연에 비해 머리 정리하셨네요 좌석 완전 한가운데 뭔가 컴퍼니 촬영할만한 그런 뷰였다 항상 사블에서만 봐서 몰랐는데 오른쪽 입장로드 빗면이네 몰랐네 그리고 중간 무대 바로 뒤여서 내가 배우님들 얼굴을 그렇게 가까이 볼 일이 있을까 꿈에도 생각하지 못할 영광이었다 이런 자리 또 올 수 있을까 천으로 장난치는 씬에서 학 얼레벌레 괴롭히는데같이 장난치다가 학 가 학 몰아놓고 혼자 튀어서결국 범인으로 몰림 학 가 엄청 서운해했어 학 퇴장 속도가 g보다 빠르네요 꿈에 대한 맵여왕 이야기 하는데 학 가 날린 천이 학 의 손 위로 떨어지는게 미쳤음 붉은 천도 연출을 도와주네 저울에 미인을 올려놓는데 차마시는 미인 모야 햊이랑 할 땐 머리넘기기 하시는데 첨봐서 깜놀 학 가 따라해서 더 웃겨 손피리 되서 학 가 와우 이게 되시네 친구들이 성악버전 캐플릿 부인과 유모 유모 혼자 리사이틀 할 때부인이랑 줄리엣 실시간으로 표정 굳어져 가는거랑부딸이랑 남편 이야기할때 미간 잡으면서 성호 긋는거랑또 다시 시작하니까 줄리엣 한테 눈치주는거 진짜 박제하고 싶다 무도회 춤 맞춘거 너무 귀여웡 자기들끼리 꽁냥꽁냥 하면서 정할거 아니야 무도회에서 둘만 알아보는 씬 진심 좋은데서로 마주보고 줄리엣 얼굴에 이게 무슨 감정이지 떠오르는 그 순간의 표정이 진짜 아니 베어에서 입학식에서 딱 마주보잖아요 첫눈에 사랑임을 알아보는거 완전 로맨틱 정숙하고 좋은 캐플릿 부인미 손들고 방방 거리던데 귀여워 왜 방방거기냐며 고나리도 받았다 다시보고 싶다 벤볼리오와 머큐쇼 로미오 불러낼 때다들 밑에 점핑판 있으신거 아니야 너무 잘뛰셔서 잔에 비 받는데 표정 영롱하다가 순식간에 잠겨드는 것도 너무해 학 오글을 눈에서 못뗄 정도 였다 홋 누워있다 엎드린것도 봤다 라방을 보고나서 장면을 직접보니 더 귀여웡생각보다 오래 있으시던데 편하신거 맞죠 최애 발코니씬 당신은 당신일 뿐 하는 대사음가 좋았다 그리고 사랑에 흠뻑빠져 표정 사르르 되는거 줄리엣이 롬에게 고백하는 대사 다 좋다 밤의 가면 쓴다는 것부터 당신 자신에게 맹세하라는 부분까지 버릴 여구들이 없다 셰익스피어 몇백년이 흘러도 감정을 훔치는 대단하신 분 학 이미 얼굴과 눈빛이 사랑에 빠진 사람 자체 줄리엣이 무슨말을 해도 오구오구 모드 맹세하려는 롬에게 왜 그렇게 아뇨아뇨아뇨 급발진 하는거지 그게 디렉인가 그부분을 그렇게 소스라치게 안했으면 좋겠다 이미 로미오 얼굴에 사랑임이 쓰여 있으니 로렌스 신부 사제관에서 둘이 꽁냥대는거왜이렇게 귀엽지 원래 그 장면에서 둘이 손잡나요 줄리엣이 나가려는 로미오 돌려세워 입맞추나요 제가 진짜 기억이 안나서 그래요 도대체 뭘 보고 나왔는지 그동안 봤던건 뭐죠 너무 좋았다는 말입니다 유모 안올라오니까 완전 씅질내는 학 자기 뼈를 뽑아준대 유모한테 땡깡 부릴때 진짜 기가막히고 코가막히는 학 와 그걸보고 웃고있는 관객들 유모 뒷 목 잡고 목소리 깔고 으르렁대는 걸까지 정말 다른 학 였다 근더 저기요 하니까 왜요 해서 학 삐짐속상해하는 학 에게 눈물도 닦아주고 코도 흥 하라했다 홋이 하는 으응 해주더라 손도 빵터졌네 귀여워 원래 해주시나 다른캐스트 다른 매력있어 좋쿤 로미오가 결혼식 신부님께 허락받는데 무대 밑에서 계속 어쩔줄 몰라하는 줄리엣 혼낼 때는 자기가 더 속상해하고 같이 간다고 할 땐 함께 기뻐하는 모습 그니까 눈을 뗄 수 없는게 이 극의 매력인것 같다 위에서 극을 하고 있어도 밖에있는 학생들을 봐야하니까 결혼식 하는데 옷 매무새를 그렇게 정리한다구요 기여웡 항상 그렇게 하시나 둘이 마주보는 순간 눈물 글썽 집중력 대박 학 소네트 진짜 어쩜 그 순간 그렇게 그런 아름다운 언어로 티볼트와 머큐쇼가 죽은 후 멍하니 있는 로미오에게 왜 이러고 서있어 하는 대사이 대사 안에 벤볼리오의 마음과 줄리엣의 마음이 함께 있어 감정이 확 올라오는 느낌이다 추방 한다 이건 다 하는 거였군 초야씬 유모가 로렌스 신부 방에 갈때부터 계속 울고있는 학 천 둘러쌓이면 실루엣만 보이는데 학 고개를 못들고 살짝 들어서 눈마주치다가 다시 숙이고마지막이라는걸 서로가 아니까 로미오가 행주같다고 이야기하는 유모 학 는이미 눈물이 한가득에 퐁퐁퐁 나고 있어서말을 못하고 계속 뒤돌고말을 하려다가도 뒤돌고 눈물타이밍 반칙이다 줄리엣 독약 마시는데 마시자마자 눈가로 또르르르르학 도 줄리엣 죽는데 죽자마자 눈물 또르르르로미오에게 독약 줄때 쳐다보지도 못하는 학 와줄리엣이 체벌 당할 때 돌아보지 않는 학 어쩌면 둘이 이렇게 데칼코마니인데한명은 바로 현실로 한명은 꿈속을 헤멜 수 밖에 없을까 마지막 요정 대사 하고 학 바라보면서 발 구르는데발 구르는거 감정이 학 에게 정신차리라고 첫번째 확 구르다가두번째는 못할 짓이라고 생각해서인지 힘주어 못하다가자신이 나쁜역할을 해야한다는 생각으로 세번째를 다시 세게 구르는데 난 정말 이 장면으로 오늘 표값을 다했다 에필로그가 진짜 취저다 학 혼자였던 모습에서 서로 같이 옷 벗고 함께 해주는 것그걸로 해피앤딩이라 생각할래 영 직접 표 잡아 들어오기를 잘했다 집중해서 눈물 뚝뚝흘리시는거랑순간순간 지나가는 표정들이 대박 아니 그리고 땀도 거의 안흘리심 옆에서 다들 녹아내리시는데 혼자만 뽀송 아이돌이시네 영넷 쓸 보고싶은데 어린나이에 하셔서 못보게 하셨지 또하면 좋겠다 햊이랑 페어하셨으면 알제 담번에 또 영 봐 막팃팅 할 때 기 영 복 해 보고싶다 근데 팃팅 가능할까 제일 뒷자리도 예대가 안터져 ,0,1,0.04878048780487805
뭐 했다고 벌써 자 이렇게 라레볼 처돌이가 되었음을 인정합니다 이 날도 아침에 부암동 CCC 본부에서 주일채플 드리고 친구들이랑 같이 점심 먹은 다음에집으로 안 가고 대학로로 왜냐면 현매 마지막 날이니까 소중한 만원의 행복 놓칠 수 없어요 재관판 대사는 본공에서 들을 때마다 울컥한다 이날의 캐스팅 홍규 레옹 최석진 서도 마리안느 임예진 원표 피에르 구준모 좌석 및 시야이날 내 좌석은 B열 번 주구장창 왼블에만 앉다가 드디어 오블에 앉아보았다 그것도 오블 벽 인 자리에 간단하게 한 줄 후기 남겨보자면 자첫 때는 비추 회전러면 한 번쯤 가 볼 만한 자리 자첫러에게 비추하는 이유는 우선 첫째로 맨 첫 장면에서 스크린에 뜨는 대사 보빙사 관련 일부가 잘린다 그나마 다행히 뭉텅 잘리지는 않고 끝에 어미 부분 그런 곳이 살짝씩 잘리기는 하지만 아무래도 자첫이면 잘렸다는 사실 자체만으로도 집중이 깨질 테니 그래도 다행히 맨 마지막에 뜨는 레옹의 수첩 문구는 안 잘린다 이게 벽싸 이라 누린 축복 인 듯 벽싸면 백퍼 다 잘렸을 것 그리고 오블은 벽 쪽으로 갈수록 등짝미가 상당히 심해진다 왼블도 등짝미가 아예 없지는 않지만 그래도 얼굴 표정이 어느 정도 보이는 수준인데 오블에 앉으면 그냥 뒤통수만 바라보게 되는 경우도 종종 생긴다 그리고 첫 장면에서 홍규와 원표가 말다툼할 때 원표가 앞쪽으로 나와서 정면 보고 말하는 순간순간 홍규가 아예 안 보이게 가려지기도 한다 그래서 자첫인 분들은 조금 뒷자리더라도 왼블 왼쪽에 가까운 중블에 앉으시는 것을 추천 그래도 장점이 아예 없지는 않다 일단 B열 즉 숫자로 치환하면 열이다 배우들 표정이 아주 생생히 보인다 특히 혁명씬 중간에 레옹이 오블 쪽으로 오면 완전완전 잘 보임 그 결연한 표정 보고 있으면 나까지 뻐렁친다 그간 오블을 잘 못 앉아본 회전러라면 등짝미를 감안하더라도 오블에서만 볼 수 있는 표정을 보는 재미도 있으니 한 번 쯤은 가 봐도 아주 나쁘지 않을 자리라고 생각한다 공연 전반 감상 이게 이제 회전을 돌게 되다 보니 전반적인 감상을 머릿속으로만 차곡차곡 정리하고 대부분 배우 위주 세부 감상을 적게 되네 근데 이거 한 줄은 완전 자신있게 외칠 수 있다 대레전 찍었음 이날 앞자리도 너도나도 기립하더라 물론 나포함 넘버라레볼 프랑스 혁명씬 이랑 피날레는 진짜 심장을 뒤흔들어놓는다 가슴이 뛴다 자 쯤 하니까 이제 가사랑 대사가 들리면서 좀 기억에 남는다 희작 당신 설마 자n 꼭 하라고 가사대사 이토록 어렵게 쓰시는 건 아니죠 큐 공연 세부 감상 배우 넘버 등 주의 스포일러가 포함되어 있습니다 아 나 아무래도 석예진 사랑하는듯 그리고 석예진준모 너무좋았 진짜 이렇게 집중 빠아악 해서 본게 얼마만이야 아니 준모원표 홍규가 자기 쏘고 뛰쳐나간 다음 총성울리면 안 돼 절규하는 거 원래 했나 이게 내가 원한 게 아니야 하면서 순간 자기 선택을 뼈저리게 후회하는 거 같았음 석홍규 그 노빠꾸 불길같은 에너지로 대사 하나하나 딱딱딱 귀에 때려박아 주는 거 너무 좋아 마리안느 마리안느 피 토하는 절규도 완전 개쓰레기 자유 음향을 뚫어버리는 그의 목소리 엄지척 석홍규가 차 마셔버린 직후 석홍규 향해서 주먹 쥐었다 아휴 관둬 하는 표정으로 내리는 준모원표 그 다음 티키타카가 레전드 홍규 커피 원표 티 홍규 어 원표 차 차 차 차 원표 아미리가 갔다온 티를 그렇게 내고싶었니 근데 생각해 보니까 홍규 커피는 알면서 티는 왜 몰라 아직 배운 영어단어가 커피밖에 없었 나 큐 이야 나 사랑에 서툴러서 감춰지지도 않는 진심 애써 감추다가 마지막에 서도 안으면서 미안해 미안해 끊임없이 되뇌며 우는 석홍규 사랑하네 이글이글 타오르는 눈빛으로 깃발 쿵쿵 찍으면서 시민들이여 일어서라 하는 석레옹 간지철철 석홍규 준모원표 오프닝 장면에서 서로 생각 대립하며 날카롭게 맞서는 거 꿀잼이다 본인들은 한껏 날세우고 있는데 보는 나는 팝콘각 와작 저번 석예진준우도 강강강 노선이라고 생각했는데 준모원표도 워낙 확고해서 그런가 여기도 강강강처럼 느껴지네 일단 기본적으로 석예진이 확신의 강강이라 눈이 빛나는 아이 이야기하며 울컥하는 석홍규는 언제 봐도 짠하고 멋있고 그렇습니다 끝맺기 전 주절주절진짜 현매이벤트 사랑했다 퍼 할인권 받아야지 한 번 볼 가격에 총 세 번이나 보다니 그리고 그 세 번을 모두 대레전 찍다니 일 일 그리고 이날 일 밤 요렇게 봤는데 전부 대대대레전 찍음 일에는 온홍규에 대차게 감기고 일에는 내가 석홍규도 사랑한다는 사실과 막내페어 합이 오진다는 사실을 알아오고 일에는 진짜 석예진 합이 최고라는 걸 다시금 실감 이날 주일채플 갔다가 공연 본 거기 때문에 주일채플까지 카메라를 바리바리 싸갈 여유가 없어서 폰으로만 찍었다 사실 카메라 사놓고 아직까지 조작도 잘 못하고 얼레벌레중 앞줄은 진짜 거의 다 기립했던 듯 진짜 좋았다 뮤지컬 라 레볼뤼시옹 대학로 자유극장 홍규 레옹 고훈정 김지온 최석진서도 마리안느 김사라 임예진원표 피에르 김찬호 구준모 이준우 ,0,1,0.1568627450980392
 우리 지역도 눈 왔다 엄청 많이 왔다 집에서 폰 만지다가 새벽 시에 눈 온다는 문자 받고 뛰어나가기전지적 슈가파우더 뿌려지는 도넛시점 무려 눈이 쌓였다 그래서 눈사람도 만들었다 불량 눈사람불만있냐 콱씨불앓 월 일집 근처에 엘피 파는 소품샵 같은거 생겨서 가봤다되게 느낌있고 깔끔했음 빌리 시강 괜히 한 번 찍어보기 귀엽 엘 피 존 옛날 노래도 많고 요즘 팝송도 있어서 좋았다중고바이닐은 들어 볼 수도 있다고 했는데 난 안 들어봤다아델 바이닐 하나 사서 집오기 집오는 길에 하늘 예뻐서 찍음 나 아델 엘피 들으면서 여기 괜히 한 번 찍어봄 나중에 뮤지컬 플북이랑 바이닐로 이 칸 다 채우는 게 목표임플북 사놓고 펴보지도 않으면서 괜히 사 모으게 됨 젠틀맨스 가이드 보고싶었는데 온라인 생중계 한대서 티켓 사서 봤다관중없이 생중계로 배우들 연기하는걸 온라인으로 보여준다굳굳자첫인데 온라인으로 봐서 좀 슬펐는데 대레전 찍어서 만족스러웠음 카메라 워킹도 좋았다 음향 아주 굳팬레터 생중계는 녹화본이라 그런가 음향 구렸는데 근데 팬레터는 딥디도 음향 구림 암튼 젠가 진짜 쌉존잼이었다 이규형 진짜 미친줄 자첫이라 어디까지가 애드립이고 어디까지가 대사인지 모르겠더라 근데 몬태변티가 대본이 아닌건 알겟음 그리고 박은태 배우님 웃참하는거 다 티나서 더 웃겼음 긍몬티 인중 자꾸 늘어나 마지막에 이규형 시국 드립때문에 오케 쪽에서 웃음소리 들림 이런 사람이 해진선생님을 연기했다니 글 쓰는 지금도 팬레터 보고있는데 자꾸 다이스뀨스 생각남 나중에 이번공연 딥디 나오면 사야지 그때 플북 같이 사야겠당 저번에 만원 당첨된 거 집 오는 길에 다시 로또 두장으로 바꿔왔다집와서 확인했는데 또 만원 당첨됨 다음주에 다시 로또로 바꿔야지 젠가 다 보고 팬레터 보면서 보석십자수하려고 했는데 이규형이 라방 틀어서 그거 봤다왜냐면 혹시 젠가 공연한거 얘기할까 싶어서 그땐 몰랐지 그 라방을 시간 분이나 볼 줄은 대충 두시간 할 줄 알았는데 무슨 라방을 시간을 넘게 하세요 심지어 시간 지나서 라방 꺼졌는데 다시 켜서 함 그리고 웃겼던거자기 주사 사람들 못 가게 잡는거라고 했는데 중간에 찐으로 취했는지 사람들 자꾸 못 가게 잡음 그러더니 말 계속하고 술 좀 깨니까 사람들보고 졸리면 자러 가라고 이규형 제법 솔직해 그리고 팬레터 노래 불러달라는 댓글 있어서 노래 잠깐 불렀는데 사람들이 김성철 찾으니까 나중에 성철이랑 같이 라방하겠다는 식으로 말했음이거 완전 그거잖아 사연 때 철세훈 온다는 얘기잖아 이거 저 존버 성공하나요 암튼 막 재밌는 것도 아니었는데 라방 끌 때까지 보고 잠 팬도 아닌데 끝까지 함께했다 일 일상 끗 잘 보고 가요 제 오셔서 자격증정보 얻고 가세요 네 좋은 정보 감사합니다 나도 너랑 로또 사러갈래 생애 첫 로또 굳굳 우리 집 근처에 로또맛집있음 토요일 저녁 쯤이면 사람들 줄 서서 삼 우리 거기서 로또사자 ,0,1,0.36
