review,cluster,action_cluster,sentiment_score
박영작가공모전 THE SHIFT Seeing the unseen 갤러리박영 올해로 기를 맞은 갤러리박영 작가공모 선정전 THE SHIFT Seeing the Unseen 은 새로운 변화를 추구하며 이상적인 소통으로의 이동 이라는 주제를 담고 있다 이번 전시에 참여한 작가들은 작품에 대한 자신만의 정체성 identity 이 뚜렷하며 이를 독특한 방식으로 작품에 투영하고 있어 더욱 특별하다 회화 설치 두 장르의 명의 작가들이 이번 전시를 위해 오랜 시간 준비했으며 이전과 다른 실험적 시도를 통해 발견하게 되는 무한한 가능성으로 이들 작가의 작품세계를 보여주고자 한다 기간 목 토 전시 기간이 연장되었습니다 시간 화 토 일 월요일 휴관 장소 갤러리박영 경기도 파주시 회동길 관람료 무료 전시장르 회화 설치 조각 주관 주최 도서출판박영사 갤러리박영 문의 갤러리박영 gallerypakyoung com 창의체험공방 모모아트 Summer event 놀이하며 크는 아이들 창의 감성놀이터 모모아트 에서 여름 이벤트 월 월 를 진행한다 제 의 뇌라 불리는 손은 아이들의 창의력 발달에 매우 중요한 역할을 한다 자신이 좋아하는 것을 표현하며 작업에 몰두하는 동안 여러 생각 감정과의 접속은 정서적으로 매우 중요한 가치가 있다 초벌 도자기에 내가 좋아하는 책표지를 디자인해서 나만의 도자접시를 만들어보고 모모잔디밭에서 신나는 물총놀이로 시원하게 더위를 날려보자 일시 월 월 매주 토요일 오전 도자기 핸드페인팅 물총놀이 오후 도자기 핸드페인팅 물총놀이 장소 모모아트 경기도 파주시 회동길 체험비 만원 대상 만 세부터 초등학교 학년까지 소요시간 초벌도자기 핸드페인팅 분 물총놀이 분 준비물 여벌옷과 수건 나만의 인생동화책 한 권 문의 및 예약 선착순 명 예약 필수 우천시 물총놀이 대신 흙놀이 주제 나만의 생각나무 로 진행됩니다 꿈을 현실로 LED로 세상의 빛을 만들다 LED SQUARE 출판도시 단계에 위치한 LED SQUARE에서는 LED의 제조 과정과 실제 제품을 경험해 볼 수 있다 또 실제 조립과 체험을 통해 우리의 생활과 밀접한 관련이 있는 LED와 친숙해질 수 있는 시간을 갖고 LED로 더욱 발전하는 우리 미래를 만나볼 수 있다 기간 상시 전시 시간 월 금 주말 공휴일 별도 문의 장소 LED SQUARE 경기도 파주시 회동길 관람료 LED SQUARE 카페 이용 시 무료 단체관람 해설자 동원 관람은 비용 별도 문의 문의 및 예약 코로나 확산 방지를 위해 운영에 변동이 있을 수 있습니다 운영 여부는 각 행사에 안내된 로 사전 문의해 주세요 책 만드는 파주출판도시 소식지 파 출 소 Vol 여름 사 출판도시입주기업협의회 책 만드는 파주출판도시 소식지 파 출 소 buk io 잔뜩 흐린 하늘이네요 오늘 좋은일만 가득하시고 대박나세요 점심 맛나게 드세요 정성스런 포스팅 꼼꼼히 읽고 갑니다 ,1,1,0.9545454545454546
수원문화재단 시즌별 행사 프리뷰 너에게 계절을 보낸다 너에게 계절을 보낸다 년에도 어김없이 봄이 시작된다 재단에도 새로운 계절이 찾아왔고 네 번의 계절도 그렇게 다가온다 아름다운 계절을 맞아 재단은 어떤 계절을 담아 당신에게 보낼까 봄 다시금 시작 뮤지컬 신비로운 여신수업 제주 신화 속 신비로운 배경과 신들을 효과적으로 표현하기 위한 Layered 방식의 홀로그램 기술과 프로젝션 맵핑 마술과 플라잉쇼 등 다양한 퍼포먼스가 접목된 이 공연은 년 월 초연 당시 큰 화제를 모았던 작품이다 기존 뮤지컬에서 볼 수 없었던 홀로그램 미디어파사드 씨르 휠 서커스 인라인 슬라럼 등 다양한 퍼포먼스를 선보여 대중들에게 새로운 공연의 패러다임을 선보일 예정이다 가족과 함께 연인과 함께 월 가정의 달을 보내기에 이 공연만큼 좋은 공연은 없을 것 같다 공연이 궁금하다면 공연 예약부터 해보는 건 어떨까 일시 금 토 장소 수원SK아트리움 대공연장 신비로운 여신수업 쇼그맨 년 수원SK아트리움 소공연장에서 진행해 큰 호응을 얻었던 쇼그맨 이번에는 더 업그레이드된 쇼그맨 로 수원SK아트리움 대공연장을 찾는다 국내 최장수 프로그램 개그콘서트 에서 큰 활약한 펼친 박성호 김재욱 김원효 이종훈 정범균이 출연하여 인 색의 퍼포먼스를 연출한다 특히 개그 경력 년 차 베테랑 개그맨 박성호를 중심으로 남녀노소 불문 누구나 재미를 만끽할 수 있는 웃음 폭탄을 선사하여 관람객들의 배꼽을 훔칠 예정이다 공연은 개그를 포함하여 마술 노래 연기 춤 레이저 쇼 등 다양하게 구성되며 월 가정의 달을 맞이하여 가족 단위의 관람객뿐만 아니라 연인 친구 등 다양한 관람객들에게도 즐거운 공연이 될 것이다 일시 토 장소 수원SK아트리움 대공연장 아트로 한바퀴코로나 의 장기화로 일상에 우울증과 스트레스를 주는 코로나 블루 이러한 아픔과 어려움을 겪고 있는 주민들과 지역 예술인이 침체된 지역 분위기를 전환하기 위해 SK아트리움 야외 공연장과 공원을 산책하며 다양한 장르의 예술을 관람하는 공간으로 소통과 공감의 시간을 가진다 야외공간에서 관객 밀집도를 낮추고 관람하는 아트로 한 바퀴는 코로나로 지친 주민들과 예술인에게 소소한 힐링을 선사한다 일시 월 월장소 수원SK아트리움 야외 공연장 인근공원 수원SK아트리움 뷰티플 데이즈 살롱 드 아트리움 화 별을 닮다 빈센트 반 고흐 화 베토벤 프리즈 클림트다시 새롭게 우리에게 주어진 한 해 어느 때보다도 현장에서 느끼는 공연의 감동이 그리워지는 올봄 수원SK아트리움 문화가 있는 날 시리즈 뷰티풀 데이즈 의 브런치공연 살롱 드 아트리움 이 첫 시작을 알린다 미디어아트로 실감 나게 재구성된 불후의 명작들이 아름다운 음악들과 함께 공연장을 수놓는다 첫 번째 시간으로 별을 닮고 싶었던 화가 빈센트 반 고흐 의 이야기가 찾아온다 그의 여 점의 작품 중 가지의 대표 작품과 더불어 동생 테오와 나눈 편지를 통해 그의 삶을 만난다 두 번째 시간은 색채 마술사 클림트 와 음악 황제 베토벤 의 운명적인 하모니가 울려 퍼진다 클림트와 베토벤은 어떻게 연결된 것일까 그들의 운명적인 만남 속으로 특별한 초대장을 건넨다 일시 화 화 장소 수원SK아트리움 소공연장 축제 행사 교육 행사정보 수원SK아트리움 문화가 있는 날 살롱 드 아트리움 수원문화재단 축제 행사 교육 행사정보 수원SK아트리움 문화가 있는 날 살롱 드 아트리움 수원문화재단 www swcf or kr 여름 더위의 서막 수원 문화재 야행역사를 품고 밤을 누비는 밤빛 품은 성곽도시 수원 문화재 야행 수원화성에 담긴 과거와 현재 기억의 흐름 따라 전하는 가지 이야기 야 도 준비되어 있다 수원 문화재 야행 이 속삭이는 월의 여름밤 화성행궁 일원에서 문화재가 전하는 밤의 아름다움을 만끽해보는 걸 추천한다 일시 금 일 장소 화성행궁 일원 에코부코 EcoBooko 페스티벌환경의 달을 맞아 월 한 달간 환경그림책 전시 및 다양한 체험 프로그램을 통해 시민들에게 자연의 소중함을 느끼는 기회를 마련한다 환경특화프로그램은 자연물과 재활용 자투리 재료를 사용하여 한정된 자원을 가지고 다양한 체험을 통해 자연스럽게 자연 보호를 실천하면서 환경보호를 배우게 되는 소중한 시간이 될 것이다 일시 월 중장소 지혜샘어린이도서관 에코부코 페스티벌 수원전통문화관 기획공연 명인열전 전통한옥에서 고즈넉하게 울려 퍼지는 우리 가락 판소리 지난해에 이어 년에도 명인열전 이 수원전통문화관에서 진행된다 올해의 주제는 판소리 다섯마당 중 네마당 적벽가 심청가 흥보가 수궁가 으로 각각의 소리를 대표하는 국가무형문화재 명창들이 출연한다 일시 월 월 중 회장소 수원전통문화관 예절교육관 명인열전 방방곡곡 문화공감 미스테리우스 한여름 우리 무대를 더욱 뜨겁게 달궈 줄 신통방통한 전통퓨전 퍼포먼스가 찾아온다 바로 년 방방곡곡 문화공감 프로젝트 첫 번째 미스테리우스 다 아름다운 전통악기의 소리와 파워풀한 랩핑 그리고 에너지 넘치는 비보이 의 몸짓이 더해져 미스테리우스한 퍼포먼스를 펼친다 전통과 현대의 예술적 요소들이 신비스럽게 결합된 뜨거운 공연 신통하다 못해 묘하며 신비스러운 시간 속으로 뜨거운 휴가를 만끽해봄이 어떨까 일시 토 장소 수원SK아트리움 소공연장 미스테리우스 창작 뮤지컬 행궁동 사람들 년 문화공감 방방곡곡 기획제작 프로그램 선정작 행궁동 사람들 수원 왕갈비 통닭만큼 유명한 왕의 골목 행궁동에서 벌어지는 이야기를 즐겁고 유쾌하게 풀어낸 창작 뮤지컬이다 정조 대왕에게 성은을 입었을 때부터 내려온 가업인 세탁소를 년째 운영하는 상인회장 정씨에게 어느 날 위기가 찾아오는데 과연 행궁동 꼰대 터줏대감 정씨는 임금님표 세탁소를 지킬 수 있을까요 본능적으로 잘 맞지 않을 것 같은 사람들의 자세한 이야기는 수원SK아트리움에서 만나요 일시 금 토 금 일 장소 수원SK아트리움 소공연장 해당 프로그램들은 코로나 를 비롯해 상황에 따라 변동될 수 있습니다 시민 여러분의 양해 바랍니다 너에게 계절을 보낸다 동시 군 구시 도국가 수원전통문화관 경기도 수원시 팔달구 장안동 예약 동시 군 구시 도국가 수원SK아트리움 경기도 수원시 장안구 이목로 수원SK아트리움 ,1,1,0.38461538461538464
 문경시청 독자 여러분출사동이입니다 여름이 깊어가는 이 시점 이 달도 점차 지나고 매월 마지막주 문화가 있는 날이돌아옵니다 곧 있으면 시작될 월을 향해반가운 문화 생활로 재충전 해보세요 랜선으로 만나는 클래식 콘서트 소개합니다 랜선으로 만나는 클래식 콘서트 온라인 공연 월 문화가 있는 날 월 문화가 있는 날을 맞이해 문경문화예술회관 주최로 랜선으로 만나는 클래식 콘서트 공연이 월 일 목 오후 시 분 유튜브로 실시간 중계됩니다 지휘자는 비엔나에서 활동 중인 김현국 그리고 뉴서울필하모니 오케스트라의 선율에 맞춰 테너 이영화 베이스 양희준 피아니스트 이상미가 협연해기대를 높이고 있습니다 공연 프로그램 윌리엄 텔 오페라의 무대로 알프스에 사는 스위스 주민들의 삶과 투쟁을 묘사한 곡 롯시니 의 윌리엄 텔 서곡 과 우리가곡 김동진 의 목련화 변훈 의 명태 재즈와 클래식이 결합한 곡 거슈원 의 랩소디 인 블루 Rhapsody In Blue 김현도 의 문경아리랑 등 여러장르의 다양한 곡들을 차례대로 관객들에게 선보일 예정입니다 랜선 공연으로 진행되는 만큼 안전하게 온라인으로 참여해클래식 콘서트를 감상할 좋은 기회입니다 이번 기회에 그간 쌓였던 문화갈증이 어느정도 해소되시면 좋겠습니다 본 공연은 유튜브에서 문경문화예술회관 채널로 검색해 감상이 가능합니다 목 실시간 방송 자세한 사항은 문경시청 홈페이지에서 확인 바랍니다 www gbmg go kr 문경시 홈페이지 통합 서비스 안내 문경시청 홈페이지 코로나 소식 정부 긴급재난지원금 코로나 입원 격리자 생활지원비 신청안내 코로나 피해자 지방세 감면 안내 맞춤형 긴급재난지원 패키지 지원사업 한시 생계지원 신청안내 문경시 지역활성화 사업 소상공인 카드수수료 지원사업 문경사랑상품권 문경 안심식당 지정 현황 www gbmg go kr 문의 문경시민들이 오케스트라의 다양한 음색 매력을 느끼며 클래식과 더욱 친숙해지는 시간을 가질 수 있도록 문경문화예술회관에서 준비한이번 월의 랜선 공연 월 일 놓치지 마시고 가족과 함께 꼭 즐겨보시길 바랍니다 포스팅 잘보고 갑니다 ,1,1,0.875
 연극 그 여름의 끝 인터파크티켓 홈페이지 극단 거북이걸음 연극 그여름의끝 은 낙서처럼 뭉처진 글자가 마치 사람의 머릿속을 가득채운 생각의 단어들을 연상케하는 포스터가 인상적이었다 비내리는 풍경을 흑백으로 사용한 배경들도 긴 장마로 우중충한 느낌을 들게하였다 높은 습도와 더위를 몰고와 지속되는 우중충한 분위기와 함께 더욱 불쾌지수를 높였던 이번 여름의 장맛비가 떠올랐고 살인사건을 자백하는 남자의 심리상담이 우리의 삶에 어떤 돌을 던질지 궁금해하며 대학로 나온씨어터 를 찾아갔다 CAST 김현수 김지훈 소년 김우성 장한나 이연조 한상훈 곽정한 민석기 장용현 연극그여름의끝 은 김지훈배우님 의 김현수 가 김우성배우님 의 소년 을 살해하는 장면부터 시작된다 그는 경찰에게 자백을 하지만 죽였다는 것 외에는 설명하지 못하고 그에게서 이상한 느낌을 받은 형사 곽정한배우님 의 한상훈 이 유명한 심리학 교수 이연조배우님 의 장한나 를 초빙해 상담을 받게 한다 상담을 하며 현수 의 이야기가 시작되고 수사진행과 그의 이야기가 엇갈려 보여지면서 실마리를 잡아가는 형식으로 진행되었다 하얀 배경과 흰색의 가구들로 이루어진 무대는 조명의 색으로 공간을 구분해 주었는데 경찰서 면담실은 흰색 조명으로 현수 의 카페는 노란색 조명으로 비추었다 또 카페는 항상 재즈 음악이 흘러나왔고 장면이 전환될 때 비 내리는 음향이 시점의 전환을 인지하게 했다 경험이 적은 형사 장용현배우님 의 민석기 는 단순하게 사건을 처리하려고 하지만 연륜이 있는 한상훈 형사는 숨겨진 사실관계를 알아내려고 노력했고 장한나 교수는 김현수 와 상담을 하면서도 자신의 개인사에 정신이 팔린다 김현수 가 조용하고 착한 사람이라고 알려져있지만 주변사람들이 그에게 관심을 가지지 않았기 때문에 그렇게 보였던 것이 아니었을까 그가 내뱉는 말에는 끝없는 외로움과 자신의 불행을 알아주지 않는 사람들에게 외치는 절규가 담겨 있었다 사람들은 의외로 가까운 곳에 관심이 없잖아요 느리더라도 의미있는 발걸음으로 삶을 공유하고 공감을 통한 위로를 전하길 바라는 극단거북이걸음 의 다섯번째 이야기는 주변인에게 더욱 관심이 없는 우리의 삶을 한번쯤 되돌아보게 만들었다 길었던 장마도 지나가고 여름도 끝이 오듯이 외로움에 고통받는 사람들이 더는 외롭지 않게 위로를 전하고 함께하는 시간들이 많아지길 바란다 lash 미지원으로 Object 코드 퍼가기 기능은 더 이상 지원되지않습니다 도움말 플 URL 대학로 연극 그여름의끝 커튼콜 극단거북이걸음대학로 연극 그여름의끝 커튼콜 극단거북이걸음 연극 그여름의끝 커튼콜 극단거북이걸음 대학로연극 연극그여름의끝 그 여름의 끝 장르 연극 장소 나온씨어터 기간 아니 새벽 세시까지 어쩌다보니 ,1,1,-0.43478260869565216
 프랜즈싱어즈 호스트 한마루 코디네이터 나비 이어진 모임 주제 의정부지역에 클래식교육활동이나 연주회를 열수있는 방향 키워드 행정지원 출연료 지원금 프로그램 어린이 관객 찾아가는 공연 공연장소 공연장 갈라콘서트 오페라단 구구소회 part 공연장소 공연장 공연장에 대한 문턱이 높음 매니아층만 가거나 여가시간이 충분한 사람만 갈 수 있는 곳으로 여겨짐 반대로 버스킹 공연에 대해 안좋게 생각하는 경향 찾아가는 공연 프로그램 의정부 예술의 전당이 있음에도 거기까지 일부러 찾아오는 사람들은 관심도가 아주 높거나 문화에 대한 열정이 높은 사람들뿐이다 클래식을 접하는 방식과 대중음악을 접하는 방식이 달라서 접하기 어렵지 않을까 그래서 찾아가는 공연을 하려고 한다 퀄리티와 상충되는 문제가 있지만 거부감 등 클래식 문화를 위해 우리가 열린 마음을 가져야 하지 않나 어린이 관객에 대해 관심이 있다 클래식을 좋아하는 아이와 공연장을 가도 아이가 견딜 수 있는 시간은 한정됨 굳이 공연장이 아닌 길거리에 지나가다가 분 멈춰서 들을 수 있는 클래식 공연이 필요 아이들이 지속적으로 볼 수 있는 문화컨텐츠가 필요하다 요즘은 너무 자극적인 미디어가 많음 순수한 컨텐츠들을 지역의 예술가들과 만들어보자 외부의 자원보다는 비용을 덜 들일 수 있는 지역의 예술가 공교육과 접하고 싶음 이번 코로나 처럼 학교를 가지 못할 때 예술 프로그램을 만들어서 제공 자연스러운 홍보 효과가 될 것 엄청 유명한 성악가보다는 우리의 이웃 우리의 친구인 예술가가 더욱 다가가기 쉬울 것 행정지원 출연료 지원금 막상 프로그램 행사를 기획해 나가려 하면 민원 전기 여러가지 허가를 받아야 하는 복잡한 문제가 있음 어떠한 창구에서 간단하게 신청할 수 있는 시스템 필요 뭔가를 하려고 하면 다 담당이 나뉘어져 있다며 이곳 저곳에 다 들리게 함 뭔가 해보고 싶은 의욕은 있는데 풀어줄 사람을 만나지 못해서 생각에 그치는 경우가 많음 서포트 해주는 창구가 필요 프로팀이기 때문에 기본적으로 먹고 살아야 하지만 현재는 막막한 상태 연습실이 매번 바뀜 공간을 구하기 위한 멤버들의 소모적인 발품이 너무 많음 의정부 문화재단 상주단체가 되고 싶음 상주단체가 되어 지원도 받고 프로그램도 하고 싶음 정착이 되었으면 좋겠음 훌륭한 단체를 뽑는게 아니라 지역에 있는 단체들을 키우는 것도 문화재단이 해야할 일이 아닌가 많은 사람들이 의정부에서 일을 하지 않으려한다 출연료를 줘도 적게 주고선 생색낸다 의정부에서 일을 하면 그만큼 대접도 안해주고 출연료도 안주고 인정을 해주지 않기 때문에 서울로 가려고 함 나의 지역이 아니라 베드타운이라고 생각하는 예술인들이 지역에 많음 이런 예술인들이 지역에서 활동할 수 있게 지원을 꼭 필요함 갈라콘서트 의정부 지역에서 오페라단을 창단하고 싶다 요즘엔 정통 클래식보다는 뮤지컬과 같은 장르가 유행 그들은 못하지만 우리는 할 수 있는 정통 클래식 구구소회 part 우리 동네에 필요한 문화는 예술공간 동네에서 가볍게 만날 수 있는 장소 어르신들이나 동네 주민들을 모시고 연주할 수 있는 장소 주민 문화 모임 주차장 주민센터 여름밤이나 시간이 있을 때 음악하는 동네 사람들끼리 만나서 가볍게 연주 만남이 있었으면 좋겠다 실제로 해보려고 생각 중이다 서로 오래 살았지만 음악에 관심있는지를 얼마전에 처음 알게된 경험 편안한 만남의 계기나 동기가 있었으면 좋겠음 밤에 놀이터에 커피들고 나와서 같이 음악하고 듣는 작은 연주회 관계를 트면 연주회 뿐만이 아니라 서로 너그러워 지면서 더욱 만남이 활발해지지 않을까 ,1,1,0.5384615384615384
