review,cluster,action_cluster,sentiment_score
so Baby A Performance Art Film Picasso Baby A Performance Art Film www universal music de 오늘의 추천 뮤비 Jay z Picasso baby 시작은 달콤하게 평범하게 최고의 맛집 외근 나왔다 이때다 하고 갔고요 이 집은 가는 크루들이 정해져있어서그들이랑만 간다 오징어 볶음과 고등어는 오마이갓김치 Previous image Next image 평일에 쉬어야 하는 날이 있어서그 김에 큰 점 빼러 피부과로 피부과 잘 안다니는데 그나마 다니던 곳이 하필 이날 휴무라 근처에 전문의 있는 곳으로 급하게 알아보고 갔음 좀 큰 점 이긴 한데 점 하나 빼는데 원 가격은 그렇다 치고 사후 f u도 없는지라 다신 점 빼러는 안갈 것 같음 초진인 줄 알고 셀털 하고 앉았는데 한번 와본적 있던데였음 유툽 알고리즘에 이끌려 흑색종이라는 것을 보아버렸고 이것을 본 이상 내 몸에 있는 점들은 쫌쫌따리 사라질 것을 예상한다 생각보다 맛있어서 놀램 밥 시간 놓쳐서 혼자 시켜 먹은 점심 종강 언제해 x발 제 or 시 그나마 잘 나온 샷 이마저도 슬라이스 삼년 만에 스크린골프 feat 근육통 폼이 다 엉망이 되었고 퍼팅에서 온한 타수와 비슷하거나 높게 나옴 feat 더블파 레슨 받고 싶다 홀까지 돌고 시간 초과 근처에 목살 먹으러 왔음 코로나 이후로 이런 고기집 오랜만에 왔다 역시 삼겹과 목살은 가게에서 궈먹어야 진리임 picasso baby ca ca casso baby 피카소 전보러 후딱 다녀옴 친구 왈 피카소 전보러 피카소 시밀러룩 입고 갔는데 사람 많아서 못봄 시밀러룩이 뭐냐 물으니 그냥 셍젬입고 가면 된다하여 호다닥 입고 갔다옴 사람은 많아서 대충만 보고 나옴 난 예술도 잘 모르고 작품보다는 공간을 더 좋아한다 사람 없는 국립현대미술관이 분위기는 최고 전형적인 예술 머글 n년전에 뉴욕 메트로폴리탄 갔다온게 생각난다 발이 쓰레기 될 때까지 걸어다녔는데 첨에 천천히 보다가 예사롭지 않은 크기에 놀라 그냥 걸어가면서 작품보고 지나치는 걸로 돌아도 몇시간 걸렸 관심 있는것만 보는 걸 추천 그날 자연사 박물관 구겐하임 메트로 모마까지 보는 과스케줄이었음 니키리 선생님 인스타 갔다가 bio에 링크 걸린 영상 보고 Queena Ko 님의 조근 말투에 치임 최고의 커피집 요즘 펠트커피에 미쳐있음 내가 서울에 집 마련 못하는 이유는 다 펠트 때문이다 최애짤 저 말 내 입으로 하면 잡아가겠지 마지막은 중독 오지는 넧례블 뭔가 먹는 사진 밖에 없는 ,3,1,0.41379310344827586
공원 와 요즘 너무 더워서 에어컨을 끼고 살고 있다그리고 습해 나는 어항 속 물고기인걸까 옌이랑 만나서 멘야하나비 합정점 갔다생각보다 맛이 강해서 좋았다냠냠 염염 뭔가 법칙 같은 게 바 테이블이 주방을 감싸고 있는 오픈형 주방은 다 맛있음사실 맛집 사장님 협회의 가입 조건이 아닐까 귀여워서 찍었당 또 딤민수 하려곸 지구제과이쯤되면 따라할 때 허락을 맡아야할 것 같다 헤헤 지구제과에서 빵 몇 개 샀다비건 글루텐프리 전문 빵집임 날씨가 돌아버려서 옌이랑 나도 돌아버리기 전에 얼른 투썸으로 피신왔다 이정도면 완전 디귿 아님 에스파 번째 멤버 상암 월드컵경기장 쪽 평화의공원 갔다왜 평화의 공원인지 알겠더라엄청 평온하고 여유로웠다 여길 이렇게 올 줄 몰랐지덕후에서 머글이 되어 다시 찾을 줄이야 드림콘서트 할 때 왔었는데멸치처럼 보였지만 규현이랑 눈 마주쳤었음암튼 그럼 아니 물이 왜 다 사라진거람나처럼 햇빛에 말라비틀어졌구나 시 쯤 되니까 분 간 분수도 나왔다 깜찍이 명이라는 뜻 왜켘 덩그러니 있지 뒷태는 슬퍼보이지만 당시엔 행복했음 집에 와서 지구제과에서 사온 빵 먹었다그리고 나는 비건과 한발짝 멀어졌다 그래도 쑥 양갱케이크는 진짜 맛있었다 다음날 점심으로 도미노피자 저녁엔 지니랑 옌이랑 블랙위도우 봤다 아 한순언니 내가 얼마나 기다렸다구 진짜 멋있었고 엔겜 나온 이 시점에선 다시 못보는 인물이라고 생각하니 눈물 엉엉이었다 오랜만에 영화다운 영화였다 아 글고 개연성 없이 다시 살려내라 루소놈들아어떻게 블랙위도우 기리는 장면 하나 없니 양아치야 후 엔겜에서 최애였던 남캐 여캐 둘 다 잃었다그땐 과몰입해서 문득 생각날 때마다 슬퍼서 일상생활 불가였삼 이후에 n차 찍으려고 용아맥 심야 예매했었는데 코로롱 때문에 약속이 취소됐다 코로롱 죽여버려 여튼 더웠지만 재밌었던 일상 끝뇽안 ,3,1,-0.16
 th Mon 오늘도 눈 뜨자마자 찾게되는 아이스아메리카노 배고파서 일어난건데 아침부터 뭘 해먹기는 귀찮고 그럴 땐 역시 씨리얼만한게 없는 것 같아요 아라비아따 파스타 크림 파스타가 먹고싶었는데 재료가 없어서 아쉽지만대신 아라비아따 해먹었어요 Dec th Tue 맨날 같은 사진밖에 없는거 같아서다른 구도로 찍었는데 뭐가 다른건지 가면 갈수록 만들기 귀찮아지는 친구가 며칠 전에 맛있다고 이야기했는데너무 궁금해서 바로 실행에 옮긴 팬케이크 시리얼 음 맛은 글쎄요 기대를 너무 많이 해서 그런가 너무 빨리 흐물해지고생각보다 별루였어요 과몰입 방지 댓글 세상 웃겨 Dec th Wen 언제 산건지 모르겠는 이디야 머그컵 컵이 좀 작아서 몇번 호로록 하면 금방 다 마셔버림 마지막으로 놀 때 그때 사온 쿠키인데수업 스밍 돌리면서 먹었어요 페인트 이희영 작가님 고 때 책 좀 자주 읽자고 샀었던 책 읽던 부분만 읽고 끝까지 못 읽었는데 이제 시간도 많고 심심하기도해서 다시 읽는 중이에요 문제의 원인 주인공과 친구의 대화 어쩌면 처한 상황과 문제의 원인은 내게 있지 않을까 내가 잘 하고있는건지 점검해 볼 필요가 있는 것 같다 Dec th Thu 집에만 있으면 입 심심할거라고 엄마가 맨날 사오는 귤 오늘 아침은 상콤하게 커피가 아니라 귤로 시작해요 체육대회도 못하고 축제까지도 못하는 마당에작년 축제 영상만 돌려보고있어요 이제 학년이라 후배들이 공연할 때밑에 앉아서 재롱잔치 보는건데 이게 뭐지 올해는 동아리실에서 늦게까지 축제 준비하다 애들이랑 컵라면 먹지고 못하고 이거 부메랑인데 엄마가 뜬금없이 크리스마스 케잌이라고 사왔어요 크리스마스 이브라고 킨건지갑자기 찾아 온 백현이 라방으로 이브는 마무리 Dec th Fri Merry Christmas 엄마가 집에만 있기 답답하다고해서갑자기 을왕리 드라이브 갔어요 카페오라에서 본 을왕리 카페오라 인천광역시 중구 을왕동 크리스마스라서 그런지 사람도 많고 그래서후다닥 나와서 차에서 먹었는데다음에는 여유롭게 다시 와야겠어요 Dec th Sat 어제 부모님이 쉬셔서 그런지일요일인 줄 알고 아침 일찍 떠진 눈 오늘은 라떼와 어제 산 녹차 스콘으로 시작 국가 장학금 신청을 미루다 미루다 급하게 신청하기 Dec th Sun 오늘도 변함없는 모닝 커피 근데 왜 이모지에는 아아는 없고 뜨아만 있을까 아이패드 고치자마자 시작된 넷플릭스 이제 작게 안봐도 된다구요 근데 왜 넷플에는 말레피센트가 없는걸까요 코로나로 학교도 제대로 못다고 한 것도 없는데 어느덧 연말이네요 부디 건강하고 안전하게 연말 마무리 하세요 팬케이크 시리얼 이라니 너무 귀여울거같아요 ,3,1,-0.08571428571428572
컬 한 번도 본 적 없고내가 보러 갈거라고 생각도 못 했다 하도 집에서 유튜브만 보니까 온 갓 영상 다 보게 된다 임한올님이 올린 시카고 영상 보고 엄청 충격 받았다 시카고가 그런 내용인지 몰랐었고 여성 위주의 뮤지컬인지 몰랐으니까 그 뒤로 해외공연 국내공연 짧막한 영상들 보면서 와 나도 저거 한 번 보고 싶다이런 생각을 했다 그리고 올해 시카고가 또 공연한다길래 가볼까 했지만 그냥 귀찮아서 말았다 근데 보면 안 될거를 봐 버렸다 청주에서 시카고 공연 한다는 사실을 알게 되어버림 그것도 차로 분 거리 항상 서울로만 공연 보러 가서 뚜벅이었던 내가 차 끌고 가서 편하게 공연 보고 밤 늦게 끝나도 여유롭게 천천히 나와서 집에 올 수 있는 청주에서 근데 이미 티켓팅 한지 몇 주 지났고 내가 원하는 출연진은 민경아 최재림 젤 인기 많은 조합인데 공연이 일요일에 딱 한 번 있음좋은 자리는 커녕 A석도 진짜 극 사이드 맨 끝만 남았다 예매처마다 좌석이 다르네 흑흑 콘서트도 무조건 맨 앞에서 보는데 처음보는 뮤지컬을 층에서 보고 싶지 않아 vip석 만원 예스는 아예 좌석 없고보니까 층 사이드나 맨 끝만 남았음 취켓팅 진짜 사람 피말리게 하는데 그냥 생각나면 가끔 들어가서 자리 있나 확인 했다 심지어 개씩 남은 s a석도 하루만에 다 없어지고 호달달달 그냥 싸게라도 보고 올걸 그랫나 어차피 나시카 망원경 있는데 뭐하러 가까이 보려고해 이런 생각 드 엇음 그냥 심심해서 들어갔는데 B열 정중앙에 자리가 난 거임 vip석 이렇게 보일 때는 살까 말까 고민하면 안 됨걍 바로 결제 완료 하악 결제하고 나니까 시야 괜찮나 더 존버해서 앞자리 잡을까 신분상승 그러다가청주예술의전당 시야 확인 할 수 있길래 들어가서 봤다 httwww cheongju go kr ac contents do key 요즘은 VR로 올려주네 심지어 보이는 시야가 내자리랑 얼추 비슷함 열이랑 번호까지너무 앞이면 전체적인거 볼 때 힘들거 같고 이정도면 괜찮다 아니 최고 아닌가 이렇게 시야까지 확인하니까 가야겠다이건 가라는거다안 가면 호구다 그래도 미련 못 버리고 신분상승하려고 예스 들락날락 중 R석 중에 좀 가까운 알석 났길래 호로록 해보니까 예스는 적립금도 쓸 수 있고 천원쿠폰에 네페까지 쓸 수 있네 만원 만원이 되는 기적 예스로 vip석 노려본다 뮤지컬은 처음이라 진 짜 기대되고 학학 저렇게 가까운데도 나시카망원경 가져가도 되나 넘 재미있을거 같아 아 그리고 넷플에 시카고 영화 있던데 보고 가면 더 재미있을까 아니면 모르는 상태인 그대로 가서 보는게 더 재미있을까 고민이다 그래도 알고 보는게 더 재미잇을거 같기두 훔 가깝긴 한데 사이드 잡을까말까 전 청주공연 못봤는데 보셨나요 부러워요 ,3,1,-0.05555555555555555
충무아트센터 대극장 김인성 첫뮤지컬 그날들 보고옴 찐 무영 왔다감 울 아기 인성이의 첫 뮤지컬 두둥 과감히 반차내고 평일 밤공을 관람하러 충무아트센터로 와버렸다 음 뮤지컬은 처음인데다 혼자가서 긴장했는뎁 캐스팅보드 찍는게 국룰인거 같아서 이 긴 대열에 합류해서 찍고야 말았다 푸항 이런게 첨이라 신기하고 또 신기 이날은 유정학 린무영 루그녀 페어였다 코로롱냐 때문에 입장할때 이 화면이랑 티켓을 보여줬다 내가 앉은 좌석에서 찍은 무대사진이다 겁내 가깝다 무대가 꽤높았지만 나는 앉은키로는 어디가서 꿇리지않는다 솔직히 월 공연 중블 열 예매한게 코로나 때문에 잠정연기되어 취소되었을때 나랑 그날들이랑은 인연이 아닌가 싶었는데 동생이 마지막 예매오픈에 중블 열을 잡아줘서 기꺼이 갔다왔다 커튼콘마저 끝나버리고 나가는 중에 아쉬운마음 품은 미련컷 중블 열은 증말이지 최고였다 연예인을 이토록 가까이서 본것도 첨이였지만 그게 내돌이라서 더 신기하고 간만에 기부니가 좋았다 잉성이의 시야 눈맞춤이라도 하고 싶으면 열 정도도 나쁘지 않을것 같다 곳곳에 전시 되어있는 린무영 얼굴 다 찍어봤다 시간 넘는 시간동안 인성이 얼굴 행동에 눈을 떼지 못했다 잘생긴건 물론이고 우리애 떡벌어진 어깨때문에 내가 다 뿌듯했고 첫 뮤지컬인데도 떨지않고 실수없이 잘 하더라 진짜 갈까말까 고민 많았는데 안갔으면 땅을 치고 후회했을듯 뮤지컬 내용은 좋았음 세세한 평가는 평론가들이 하시고 저는 그냥 린무영 얼굴 보러 갔었답니다 ,3,1,0.21052631578947367
 내 콘서트 돌려내라 코로롱냐 녀석아오프라인 콘서트 하지도 모다는데 응원봉만 새로 나오고 나는 그걸 또 사고 눈물이 난다 마데워치 를 흔들며 From 씨 오프라인보다는 온라인 공연이 활성화되고 있는데요 요즘 보면 인상 깊은 공연을 소개해 주실래요 ,3,1,-1.0
클럽헤비 데빌킹 공연 갔을 때 오칠도 같이 해서 오 데빌킹 공연이 나중에라도 하면 좋겠다고 생각했는데 오 드링킹 공연이 잡혔다 오 데빌킹 티저 공연이라고 생각할게요 나중에 꼬옥 해주면 돼 분홍색 브릿지 단 거 넘 잘 어울리셔 저도 뛰고 싶어요 이번에도 피크를 많이 던지셨는데 난 득템 못했네 언제나 에너지 넘치는 드링킹소년소녀합창단 사진 많이 못 찍어드려서 죄송해요 흑흑 미나님이 웃으면서 연주할 땐 나도 기분이 좋다 희희 석제님 반갑습니다 오칠은 진짜 개멋있다 킹왕짱굳 마수맄 머리 흔드느라 정신 없어서 사진을 많이 못 찍었구려 푸흡 앵콜 나왔지옹 아 언제나 할 말을 제대로 못하고 뚝딱거리며 얼레벌레 인사해버리고 공연장 나서는 것 같아서 아쉽다 끝나고 바로 서울 간다는 말에 피곤하시겠다 조심히 올라가세요 라고 했어야 했으며 멋있다라는 말을 번쯤 더 외쳐주고 왔어야했는데 멋있는 사람들 ,3,1,0.6666666666666666
포터 예매 풀리던 날 용산만 뒤늦게 풀렸었다 존버하다가 영화보고 온 사이에 풀린거 진심 극사이드 자리 겨우 잡아놓고 기다렸는데 신천지 때문에 나가지 말라는거임 그래도 불의잔 재개봉 하려면 년은 기다려야될텐데 봐야겠다 싶어서 그나마 가까운 강변 CGV 가서 봐씀 불의 잔은 꼭 용산 가서 보려고 처음으로 D 보는거라 자리도 그렇고 팝콘 먹어도 되나 요즘은 못먹게함 고민 했는데 그냥 얼레벌레 망고요구르트 사서 입장함 공차 망고 요구르트는 당도 얼음 less 알로에펄 추가가 존맛탱인거 알아주 포토티켓은 호그와트 행 티켓 사진으로 했당 예쁘게 잘나와서 만족 솔직히 아즈카반의 죄수 자체는 못해도 번은 봤던 영화라 별다른 감상은 없다 여전히 재밌지 뭐 DX 후기 생각보다 다이나믹 하지는 않고 영화를 조금 더 재밌게 볼 수 있는 요소인 것 같다 엉덩이로 진동 느껴지고 좀 작은 움직임에도 의자 기울어지는 효과를 줘서 집 와서 누워있는데도 몸이 움직이는 것 같다 완전 웃김 그리고 좀 뒷열이어서 그런진 몰라도 무대쪽에서 연기 나오는 걸 봤는데 내쪽으로 전혀 안왔음 계속 말하지만 다음엔 꼭 용산가서 봐야지 ,3,1,0.42857142857142855
는 왜 몰랐을까 방방콘 때 풀어준 것들이 얼마나 귀한 것들이었는지 년 월 일 유료 컨텐츠들 개 유튜브에서 그 시간에만 공개했는데 아직 입덕 초기라 얼레벌레 뭘 봐야할지 몰랐어 BTS BEGINS 서울 회만 한 공연 부산 매직샵 TH MUSTER 공연 LOVE YOURSELF SPEAK YOURSELF 브라질 상파울루 공연 난 역시 좀 느려 빠릿하게 바로 알아차렸어야하는데 매직샵이랑 상파울루는 좀 보기는 했는데 식구들 밥도 차려줘야 하고 어떤게 더 귀한지도 몰라서 흘려보냈네 엉엉 아 아숩다 아수워 년 첫 방방콘때는 더 어마무시하게 풀었네 이틀동안 화양연화콘서트랑 삼부작 콘서트 TH TH MUSTER 윙즈콘에 LY콘서트 SEOUL 에 T T그래 늦게 입덕한 팬들은 아쉬운게 많은게 정상이지 남들 다 아미될때 뭐했니 나 오늘도 반성 아 글고 고맘때 JTBC에서 매주 목욜에 하나씩 던져준것들도 꽤 열심히 보긴 했다 전후가 헷갈려서 머리속이 엉망 정리는 안된다만 그래도 지금은 갑자기 브이라이브에 지민이 와서 실시간 보고 있어 아무도 없으니 눈치보지 않고 폰이랑 노트북 둘다 켜놓고 바쁘다 바뻐 ,3,1,0.0
 막둥이촤 차때 또 온대 올해 나는 시카고에 갇혔어 오늘이 오늘일기 마지막 날이 맞던가 챌린지를 처음 시작할때까지만 해도 매일 하나씩 글을 올릴 수 있을까 걱정스러웠는데 결국 얼레벌레 해냈다 그간 어떻게 지내시는지 몰랐던 이웃분들 안부도 알 수 있었고 여러 사람들의 일상을 구경하기도 하면서 쏠쏠하게 재미있었다 내 글도 즐겁게 읽어준 사람이 있었다면 그것만으로도 의미가 컸다고 본다 읽어주신 모든 분들께 감사드립니다 마지막날 유종의 미를 거두기 위해 어떤 이야기를 마지막으로 남겨야할지 고민했는데 덕후가 덕질관련 글이나 쓰는거지 다른 뭘 쓰겠어 결국 하던대로 뮤 관련 얘기나 끄적이기로 했다 오늘 오전에 쓸 차 캐슷이 발표됐다 발표가 늦길래 나는 이번주 총막공 무인때나 풀어주려나 했었는데 정말 난데없었다 마침 한가하던 때여서 알람이 뜨자마자 확인을 했는데 우리 애기리차드가 차 캐슷에 이름이 또 올라와 있는거야 차기작이 없는데 공연중에 갑자기 염색을 하고 온 날이 있어서 긴가민가 했었는데 이렇게 확정이 나다니 다른 차 배우들은 전부 다른 극 차기작이 떴고 석준촤만 이렇게 다시 시카고로 귀환한다 차때 새로 합류하는 명의 촤와 명의 넷 모두 경력직인 석촤보다 나이가 많던데 낯선 얼굴들이어서 무대 위에서 어떤 모습을 보여줄지 우려와 기대가 크다 나 정말 월에 석준열 올때까진 관극 적당히 쉬면서 돌려고 했는데 아무래도 시카고에 갇힌것같지 차때 오는걸보니 아무래도 대구공까지 올것같은데 얼른 달컴 유료회원 가입이나 해둬야겠다 충무에서 다시 만나 석준촤야 그때는 차보다 좋은 자리에서 블챌 오늘일기 ,3,1,0.5333333333333333
주 지나서 쓰는 교향악 축제 후기 실황 공연을 매우 좋아하는 나인데혐생에 치이고 코로나에 치이다보니 작년부터 제대로 된 공연이란걸 가본 적 없는나를 위해 내가 준비한 선물 대망의 교향악 축제 바로바로 년 교향악 축제 대학교 다닐 땐 정말 쉬지 않고 찾아다녔었는데 아련 심지어 학생할인으로 만원에 콘서트를 즐길 수 있어서 원없이 다녔지 히읗 하지만 지금의 난 무려 만원짜리 S석도 서슴지 않고 예매할 줄 아는 이 시대의 노예닷 땨란 올해는 에 있었던 강남 심포니 오케스트라 공연을 예매했는데 내가 공연 고르는 기준은 무 적 권 프 로 그 램 오케스트라의 명성이나 지휘자는 고려하지 않는거다 물론 유명 오케스트라나 협연자나 지휘자 보고 고를 때도 있지만 교향악 축제만큼은 프로그램 보고 고르게 되네 다른 거 다 필요없고 라흐 에 꽂혀서 갔다라흐 는 사랑임다 개고생했던 추억이 깃든 라흐 각설하고 간만에 찾아뵙는 예당의 웅장한 외관에 공연장 들어서기 전부터 설렜지 뭐야 핡 는 회사에서 생각보다 멀어서 이 사진 찍고 미친듯이 뜀 공연 분 전 착석 갓댐 한화 다니면 이 티켓 무료로 주나여 늘 가장 설레는 순간 공연 시작 전 관객들의 웅성웅성 소리로 가득찬 연주장 이하 주관적인 후기 공연은 생각보다 그냥 그랬다 너무 기대를 많이 하고 가서 그런가 부 전반적으로 현과 관의 밸런스가 안맞는 기분 내 좌석 탓인지도 모르겠지만 다소 어우러지지 않았던 것 같음 특히 호른쨩이 현악기들의 멜로디를 뭉근하게 아래서 받쳐줘야 하는데 위에서 짓누르는 느낌 무대 특수효과로 깔리는 드라이아이스 연기처럼 은근하게 깔리길 바랐는데 협연자님은 오케스트라를 뚫고 나오는 힘이 없어서 이 또한 아쉬움 부는 그래도 부보다 좋았다전반적인 셈여림이 독특해서 약간 읭 스러웠지만 라흐 조아조아 이 날 앵콜은 스타워즈 메들리 했는데 이걸 젤 잘했다 목 금관 빵빵 터지고 씐남 앞에 애기 무려 기립박수함 쏘 큩 간만에 예술의 전당오니 기분도 너무 좋고 연주자들의 숨소리까지 따라갈 수 있는 실황 공연의 맛을 잊고 있다가 다시금 깨달을 수 있어서 즐거웠다 그래그래 이 맛에 돈벌고 공연 보러 다니지 어서 바지런히 롯데콘서트 홀에서도 무슨 공연 하는지 보고 예매해야지 그러기 위해서 난 오늘도 출 근 문화생활 즐기시는 모습 보기 좋네요 잘 보고갑니다 와 이렇게 댓글도 남겨주시고 감사할따름 ,3,1,1.1724137931034482
 사랑하는 친구들 더운 여름 어찌 잘 보내고 계신감 새벽에 혼자 너네 읽는거 재밌어서 나도 가끔 글 써보려고 나도 친구들 이름 초성으로 쓸게잉 가 뮤지컬 해보라 해서 냅다 시작함요 초등학교 때는 클래식 좋아하시는 막내이모 덕분에 오페라랑 연주화 많이 따라가봤고 뮤지컬은 중딩때부터 꾸준히 봐왔어 관극일지랑 좋은 뮤지컬 넘버 소개하는 글 많이 올릴게 아무말이 난무하지만 날 생각하면서 읽어주시길 읽다가 갑자기 나 보고싶으면 전화해 풉킥 ,3,1,1.1666666666666667
 의심치 않아 작년 오늘 몬엑 공식 트위터 계정에 체조콘 일정이 떴었다고 한다 물론 이시국이 아니었다면 내가 몬엑 입덕이 가능했었을까 싶긴 하고 저 콘서트도 어찌됐던 나는 못 갔을 거긴 한데 진짜 많이 아쉽다 월드투어라 줄줄이 공연 예정됐던 거 다 취소되고 년도 솔직히 해외 공연은 불가능이고 한국도 불투명 이시국 풀리면 단기간에 폭발적으로 공연 수요 늘어서 대관할 장소가 모자랄 거 같은데 이건 여튼 코시국 끝난 뒤의 행회니까 흑흑 그치만 난 믿어 몬스타엑스 콘서트 반드시 간다 쟁취한다 딱 기다려 얘두라 내가 죽기 전에 몬둥이는 한번 휘둘러봐야지 ,3,1,-0.1111111111111111
 일단 살기 싫다 존 살기 싫음 울 아기 강쥐얌 글애도 울 혀기 보면서 살아간다 내 자양강장제 윤재혁 내가 감히 널 사랑혀 광흥창 번 출구 나오면 보이는 장미 요건 광흥창 놈들 만나러 갈 때 보이는 장미저번에도 말했던 것 같은데 나 꽤 장미에 진심인 듯 꿀팁 꿀팁 공유합니다이제 날씨가 슬슬 더워져서 약냉방칸 피해야 함 음 그러니까 요약하면내가 개고생 하다가 뒤진다는 거 아녀 음 Mmm 그니까 자살살 껴있다는 거네 근데 진심 요즘 살기 싫음그럼에도 불구하고 열심히 사는 나 제법 젠틀해요 ticket melon com performance indehtm prodId 그리고 드디어 예매 오픈한 You are June자리 얼마 안 남았응게 퍼뜩 예매하쇼잉 여 오면 나도 볼 수 있고 윱니 말로는 이도 볼 수 있다는데님들이 와서 함 보셔요 우리 기획팀 연출팀 PR팀 마케팅팀 영상팀 총 명이 고생해서 올리는 공연이여요많은 관심과 사랑과 예매 부탁드림미당 엔분의일 단독공연 You are June 듣다 보다 만나다 멜론티켓 ticket melon com www youtube com watch v F joBIEbjY ,3,1,-0.8181818181818182
